[{"date":"2025-11-25","time":"23:45","flight":[{"no":"HX 283","airline":"CRK"},{"no":"BR 2891","airline":"EVA"}],"origin_dest":["TPE"],"status":"At gate 00:05 (26/11/2025)","gate_baggage":"15","terminal":"","isArrival":true,"isCargo":false,"_raw":{"aisle":"","hall":"B"}},{"date":"2025-11-27","time":"23:45","flight":[{"no":"HX 283","airline":"CRK"},{"no":"BR 2891","airline":"EVA"}],"origin_dest":["TPE"],"status":"At gate 23:30","gate_baggage":"6","terminal":"","isArrival":true,"isCargo":false,"_raw":{"aisle":"","hall":"A"}},{"date":"2025-11-29","time":"23:45","flight":[{"no":"HX 283","airline":"CRK"},{"no":"BR 2891","airline":"EVA"}],"origin_dest":["TPE"],"status":"At gate 23:27","gate_baggage":"13","terminal":"","isArrival":true,"isCargo":false,"_raw":{"aisle":"","hall":"B"}},{"date":"2025-11-30","time":"23:45","flight":[{"no":"HX 283","airline":"CRK"},{"no":"BR 2891","airline":"EVA"}],"origin_dest":["TPE"],"status":"At gate 00:13 (01/12/2025)","gate_baggage":"6","terminal":"","isArrival":true,"isCargo":false,"_raw":{"aisle":"","hall":"A"}},{"date":"2025-12-01","time":"23:45","flight":[{"no":"HX 283","airline":"CRK"},{"no":"BR 2891","airline":"EVA"}],"origin_dest":["TPE"],"status":"At gate 23:21","gate_baggage":"9","terminal":"","isArrival":true,"isCargo":false,"_raw":{"aisle":"","hall":"A"}},{"date":"2025-12-02","time":"23:45","flight":[{"no":"HX 283","airline":"CRK"},{"no":"BR 2891","airline":"EVA"}],"origin_dest":["TPE"],"status":"At gate 23:35","gate_baggage":"9","terminal":"","isArrival":true,"isCargo":false,"_raw":{"aisle":"","hall":"A"}},{"date":"2025-12-03","time":"23:45","flight":[{"no":"HX 283","airline":"CRK"},{"no":"BR 2891","airline":"EVA"}],"origin_dest":["TPE"],"status":"At gate 23:37","gate_baggage":"8","terminal":"","isArrival":true,"isCargo":false,"_raw":{"aisle":"","hall":"A"}},{"date":"2025-12-04","time":"23:45","flight":[{"no":"HX 283","airline":"CRK"},{"no":"BR 2891","airline":"EVA"}],"origin_dest":["TPE"],"status":"At gate 23:22","gate_baggage":"15","terminal":"","isArrival":true,"isCargo":false,"_raw":{"aisle":"","hall":"B"}},{"date":"2025-12-05","time":"23:45","flight":[{"no":"HX 283","airline":"CRK"},{"no":"BR 2891","airline":"EVA"}],"origin_dest":["TPE"],"status":"At gate 23:44","gate_baggage":"12","terminal":"","isArrival":true,"isCargo":false,"_raw":{"aisle":"","hall":"B"}},{"date":"2025-12-06","time":"23:45","flight":[{"no":"HX 283","airline":"CRK"},{"no":"BR 2891","airline":"EVA"}],"origin_dest":["TPE"],"status":"At gate 23:29","gate_baggage":"13","terminal":"","isArrival":true,"isCargo":false,"_raw":{"aisle":"","hall":"B"}},{"date":"2025-12-07","time":"23:45","flight":[{"no":"HX 283","airline":"CRK"},{"no":"BR 2891","airline":"EVA"}],"origin_dest":["TPE"],"status":"At gate 23:59","gate_baggage":"16","terminal":"","isArrival":true,"isCargo":false,"_raw":{"aisle":"","hall":"B"}},{"date":"2025-12-08","time":"23:45","flight":[{"no":"HX 283","airline":"CRK"},{"no":"BR 2891","airline":"EVA"}],"origin_dest":["TPE"],"status":"At gate 23:31","gate_baggage":"15","terminal":"","isArrival":true,"isCargo":false,"_raw":{"aisle":"","hall":"B"}},{"date":"2025-12-09","time":"23:45","flight":[{"no":"HX 283","airline":"CRK"},{"no":"BR 2891","airline":"EVA"}],"origin_dest":["TPE"],"status":"At gate 23:44","gate_baggage":"12","terminal":"","isArrival":true,"isCargo":false,"_raw":{"aisle":"","hall":"B"}},{"date":"2025-12-10","time":"23:45","flight":[{"no":"HX 283","airline":"CRK"},{"no":"BR 2891","airline":"EVA"}],"origin_dest":["TPE"],"status":"At gate 23:32","gate_baggage":"15","terminal":"","isArrival":true,"isCargo":false,"_raw":{"aisle":"","hall":"B"}},{"date":"2025-12-11","time":"23:45","flight":[{"no":"HX 283","airline":"CRK"},{"no":"BR 2891","airline":"EVA"}],"origin_dest":["TPE"],"status":"At gate 23:31","gate_baggage":"15","terminal":"","isArrival":true,"isCargo":false,"_raw":{"aisle":"","hall":"B"}},{"date":"2025-12-12","time":"23:45","flight":[{"no":"HX 283","airline":"CRK"},{"no":"BR 2891","airline":"EVA"}],"origin_dest":["TPE"],"status":"At gate 23:49","gate_baggage":"14","terminal":"","isArrival":true,"isCargo":false,"_raw":{"aisle":"","hall":"B"}},{"date":"2025-12-13","time":"23:45","flight":[{"no":"HX 283","airline":"CRK"},{"no":"BR 2891","airline":"EVA"}],"origin_dest":["TPE"],"status":"At gate 00:00 (14/12/2025)","gate_baggage":"13","terminal":"","isArrival":true,"isCargo":false,"_raw":{"aisle":"","hall":"B"}},{"date":"2025-12-14","time":"23:45","flight":[{"no":"HX 283","airline":"CRK"},{"no":"BR 2891","airline":"EVA"}],"origin_dest":["TPE"],"status":"At gate 00:02 (15/12/2025)","gate_baggage":"14","terminal":"","isArrival":true,"isCargo":false,"_raw":{"aisle":"","hall":"B"}},{"date":"2025-12-15","time":"23:45","flight":[{"no":"HX 283","airline":"CRK"},{"no":"BR 2891","airline":"EVA"}],"origin_dest":["TPE"],"status":"At gate 23:45","gate_baggage":"15","terminal":"","isArrival":true,"isCargo":false,"_raw":{"aisle":"","hall":"B"}},{"date":"2025-12-16","time":"23:45","flight":[{"no":"HX 283","airline":"CRK"},{"no":"BR 2891","airline":"EVA"}],"origin_dest":["TPE"],"status":"At gate 23:31","gate_baggage":"14","terminal":"","isArrival":true,"isCargo":false,"_raw":{"aisle":"","hall":"B"}},{"date":"2025-12-17","time":"23:45","flight":[{"no":"HX 283","airline":"CRK"},{"no":"BR 2891","airline":"EVA"}],"origin_dest":["TPE"],"status":"At gate 00:04 (18/12/2025)","gate_baggage":"16","terminal":"","isArrival":true,"isCargo":false,"_raw":{"aisle":"","hall":"B"}},{"date":"2025-12-18","time":"23:45","flight":[{"no":"HX 283","airline":"CRK"},{"no":"BR 2891","airline":"EVA"}],"origin_dest":["TPE"],"status":"At gate 23:53","gate_baggage":"14","terminal":"","isArrival":true,"isCargo":false,"_raw":{"aisle":"","hall":"B"}},{"date":"2025-12-19","time":"23:45","flight":[{"no":"HX 283","airline":"CRK"},{"no":"BR 2891","airline":"EVA"}],"origin_dest":["TPE"],"status":"At gate 01:12 (20/12/2025)","gate_baggage":"14","terminal":"","isArrival":true,"isCargo":false,"_raw":{"aisle":"","hall":"B"}},{"date":"2025-12-20","time":"23:45","flight":[{"no":"HX 283","airline":"CRK"},{"no":"BR 2891","airline":"EVA"}],"origin_dest":["TPE"],"status":"At gate 23:48","gate_baggage":"15","terminal":"","isArrival":true,"isCargo":false,"_raw":{"aisle":"","hall":"B"}},{"date":"2025-12-21","time":"23:45","flight":[{"no":"HX 283","airline":"CRK"},{"no":"BR 2891","airline":"EVA"}],"origin_dest":["TPE"],"status":"At gate 23:52","gate_baggage":"12","terminal":"","isArrival":true,"isCargo":false,"_raw":{"aisle":"","hall":"B"}},{"date":"2025-12-22","time":"23:45","flight":[{"no":"HX 283","airline":"CRK"},{"no":"BR 2891","airline":"EVA"}],"origin_dest":["TPE"],"status":"At gate 01:35 (23/12/2025)","gate_baggage":"8","terminal":"","isArrival":true,"isCargo":false,"_raw":{"aisle":"","hall":"A"}},{"date":"2025-12-23","time":"23:45","flight":[{"no":"HX 283","airline":"CRK"},{"no":"BR 2891","airline":"EVA"}],"origin_dest":["TPE"],"status":"At gate 23:31","gate_baggage":"12","terminal":"","isArrival":true,"isCargo":false,"_raw":{"aisle":"","hall":"B"}},{"date":"2025-12-24","time":"23:45","flight":[{"no":"HX 283","airline":"CRK"},{"no":"BR 2891","airline":"EVA"}],"origin_dest":["TPE"],"status":"At gate 00:15 (25/12/2025)","gate_baggage":"15","terminal":"","isArrival":true,"isCargo":false,"_raw":{"aisle":"","hall":"B"}},{"date":"2025-12-25","time":"23:45","flight":[{"no":"HX 283","airline":"CRK"},{"no":"BR 2891","airline":"EVA"}],"origin_dest":["TPE"],"status":"At gate 00:18 (26/12/2025)","gate_baggage":"12","terminal":"","isArrival":true,"isCargo":false,"_raw":{"aisle":"","hall":"B"}},{"date":"2025-12-26","time":"23:45","flight":[{"no":"HX 283","airline":"CRK"},{"no":"BR 2891","airline":"EVA"}],"origin_dest":["TPE"],"status":"At gate 23:38","gate_baggage":"14","terminal":"","isArrival":true,"isCargo":false,"_raw":{"aisle":"","hall":"B"}},{"date":"2025-12-27","time":"23:45","flight":[{"no":"HX 283","airline":"CRK"},{"no":"BR 2891","airline":"EVA"}],"origin_dest":["TPE"],"status":"At gate 00:20 (28/12/2025)","gate_baggage":"14","terminal":"","isArrival":true,"isCargo":false,"_raw":{"aisle":"","hall":"B"}},{"date":"2025-12-28","time":"23:45","flight":[{"no":"HX 283","airline":"CRK"},{"no":"BR 2891","airline":"EVA"}],"origin_dest":["TPE"],"status":"At gate 23:46","gate_baggage":"13","terminal":"","isArrival":true,"isCargo":false,"_raw":{"aisle":"","hall":"B"}},{"date":"2025-12-29","time":"23:45","flight":[{"no":"HX 283","airline":"CRK"},{"no":"BR 2891","airline":"EVA"}],"origin_dest":["TPE"],"status":"At gate 23:44","gate_baggage":"6","terminal":"","isArrival":true,"isCargo":false,"_raw":{"aisle":"","hall":"A"}},{"date":"2025-12-30","time":"23:45","flight":[{"no":"HX 283","airline":"CRK"},{"no":"BR 2891","airline":"EVA"}],"origin_dest":["TPE"],"status":"At gate 00:15 (31/12/2025)","gate_baggage":"14","terminal":"","isArrival":true,"isCargo":false,"_raw":{"aisle":"","hall":"B"}},{"date":"2025-12-31","time":"23:45","flight":[{"no":"HX 283","airline":"CRK"},{"no":"BR 2891","airline":"EVA"}],"origin_dest":["TPE"],"status":"At gate 00:06 (01/01/2026)","gate_baggage":"16","terminal":"","isArrival":true,"isCargo":false,"_raw":{"aisle":"","hall":"B"}},{"date":"2026-01-01","time":"23:45","flight":[{"no":"HX 283","airline":"CRK"},{"no":"BR 2891","airline":"EVA"}],"origin_dest":["TPE"],"status":"At gate 00:18 (02/01/2026)","gate_baggage":"15","terminal":"","isArrival":true,"isCargo":false,"_raw":{"aisle":"","hall":"B"}},{"date":"2026-01-02","time":"23:45","flight":[{"no":"HX 283","airline":"CRK"},{"no":"BR 2891","airline":"EVA"}],"origin_dest":["TPE"],"status":"At gate 00:09 (03/01/2026)","gate_baggage":"16","terminal":"","isArrival":true,"isCargo":false,"_raw":{"aisle":"","hall":"B"}},{"date":"2026-01-03","time":"23:45","flight":[{"no":"HX 283","airline":"CRK"},{"no":"BR 2891","airline":"EVA"}],"origin_dest":["TPE"],"status":"At gate 23:57","gate_baggage":"14","terminal":"","isArrival":true,"isCargo":false,"_raw":{"aisle":"","hall":"B"}},{"date":"2026-01-04","time":"23:45","flight":[{"no":"HX 283","airline":"CRK"},{"no":"BR 2891","airline":"EVA"}],"origin_dest":["TPE"],"status":"At gate 00:07 (05/01/2026)","gate_baggage":"14","terminal":"","isArrival":true,"isCargo":false,"_raw":{"aisle":"","hall":"B"}},{"date":"2026-01-05","time":"23:45","flight":[{"no":"HX 283","airline":"CRK"},{"no":"BR 2891","airline":"EVA"}],"origin_dest":["TPE"],"status":"At gate 23:41","gate_baggage":"12","terminal":"","isArrival":true,"isCargo":false,"_raw":{"aisle":"","hall":"B"}},{"date":"2026-01-06","time":"23:45","flight":[{"no":"HX 283","airline":"CRK"},{"no":"BR 2891","airline":"EVA"}],"origin_dest":["TPE"],"status":"At gate 00:09 (07/01/2026)","gate_baggage":"13","terminal":"","isArrival":true,"isCargo":false,"_raw":{"aisle":"","hall":"B"}},{"date":"2026-01-07","time":"23:45","flight":[{"no":"HX 283","airline":"CRK"},{"no":"BR 2891","airline":"EVA"}],"origin_dest":["TPE"],"status":"At gate 23:25","gate_baggage":"16","terminal":"","isArrival":true,"isCargo":false,"_raw":{"aisle":"","hall":"B"}},{"date":"2026-01-09","time":"23:45","flight":[{"no":"HX 283","airline":"CRK"},{"no":"BR 2891","airline":"EVA"}],"origin_dest":["TPE"],"status":"At gate 23:38","gate_baggage":"16","terminal":"","isArrival":true,"isCargo":false,"_raw":{"aisle":"","hall":"B"}},{"date":"2026-01-10","time":"23:45","flight":[{"no":"HX 283","airline":"CRK"},{"no":"BR 2891","airline":"EVA"}],"origin_dest":["TPE"],"status":"At gate 23:45","gate_baggage":"16","terminal":"","isArrival":true,"isCargo":false,"_raw":{"aisle":"","hall":"B"}},{"date":"2026-01-11","time":"23:45","flight":[{"no":"HX 283","airline":"CRK"},{"no":"BR 2891","airline":"EVA"}],"origin_dest":["TPE"],"status":"At gate 23:31","gate_baggage":"13","terminal":"","isArrival":true,"isCargo":false,"_raw":{"aisle":"","hall":"B"}},{"date":"2026-01-12","time":"23:45","flight":[{"no":"HX 283","airline":"CRK"},{"no":"BR 2891","airline":"EVA"}],"origin_dest":["TPE"],"status":"At gate 23:34","gate_baggage":"14","terminal":"","isArrival":true,"isCargo":false,"_raw":{"aisle":"","hall":"B"}},{"date":"2026-01-14","time":"23:45","flight":[{"no":"HX 283","airline":"CRK"},{"no":"BR 2891","airline":"EVA"}],"origin_dest":["TPE"],"status":"At gate 00:32 (15/01/2026)","gate_baggage":"15","terminal":"","isArrival":true,"isCargo":false,"_raw":{"aisle":"","hall":"B"}},{"date":"2026-01-16","time":"23:45","flight":[{"no":"HX 283","airline":"CRK"},{"no":"BR 2891","airline":"EVA"}],"origin_dest":["TPE"],"status":"","gate_baggage":"","terminal":"","isArrival":true,"isCargo":false,"_raw":{"aisle":"","hall":""}},{"date":"2026-01-17","time":"23:45","flight":[{"no":"HX 283","airline":"CRK"},{"no":"BR 2891","airline":"EVA"}],"origin_dest":["TPE"],"status":"At gate 23:22","gate_baggage":"13","terminal":"","isArrival":true,"isCargo":false,"_raw":{"aisle":"","hall":"B"}},{"date":"2026-01-18","time":"23:45","flight":[{"no":"HX 283","airline":"CRK"},{"no":"BR 2891","airline":"EVA"}],"origin_dest":["TPE"],"status":"At gate 23:19","gate_baggage":"12","terminal":"","isArrival":true,"isCargo":false,"_raw":{"aisle":"","hall":"B"}}]
