[{"date":"2025-12-01","time":"23:55","flight":[{"no":"CX 255","airline":"CPA"}],"origin_dest":["LHR"],"status":"Dep 00:05 (02/12/2025)","gate_baggage":"67","terminal":"T1","isArrival":false,"isCargo":false,"_raw":{"aisle":"C","hall":""}},{"date":"2025-12-02","time":"23:55","flight":[{"no":"CX 255","airline":"CPA"}],"origin_dest":["LHR"],"status":"Dep 00:01 (03/12/2025)","gate_baggage":"44","terminal":"T1","isArrival":false,"isCargo":false,"_raw":{"aisle":"BC","hall":""}},{"date":"2025-12-03","time":"23:55","flight":[{"no":"CX 255","airline":"CPA"}],"origin_dest":["LHR"],"status":"Dep 00:07 (04/12/2025)","gate_baggage":"64","terminal":"T1","isArrival":false,"isCargo":false,"_raw":{"aisle":"BC","hall":""}},{"date":"2025-12-04","time":"23:55","flight":[{"no":"CX 255","airline":"CPA"}],"origin_dest":["LHR"],"status":"Dep 23:56","gate_baggage":"44","terminal":"T1","isArrival":false,"isCargo":false,"_raw":{"aisle":"BC","hall":""}},{"date":"2025-12-05","time":"23:55","flight":[{"no":"CX 255","airline":"CPA"}],"origin_dest":["LHR"],"status":"Dep 00:06 (06/12/2025)","gate_baggage":"29","terminal":"T1","isArrival":false,"isCargo":false,"_raw":{"aisle":"BC","hall":""}},{"date":"2025-12-06","time":"23:55","flight":[{"no":"CX 255","airline":"CPA"}],"origin_dest":["LHR"],"status":"Dep 02:01 (07/12/2025)","gate_baggage":"3","terminal":"T1","isArrival":false,"isCargo":false,"_raw":{"aisle":"BC","hall":""}},{"date":"2025-12-07","time":"23:55","flight":[{"no":"CX 255","airline":"CPA"}],"origin_dest":["LHR"],"status":"Dep 00:47 (08/12/2025)","gate_baggage":"7","terminal":"T1","isArrival":false,"isCargo":false,"_raw":{"aisle":"BC","hall":""}},{"date":"2025-12-08","time":"23:55","flight":[{"no":"CX 255","airline":"CPA"}],"origin_dest":["LHR"],"status":"Dep 00:00 (09/12/2025)","gate_baggage":"45","terminal":"T1","isArrival":false,"isCargo":false,"_raw":{"aisle":"BC","hall":""}},{"date":"2025-12-09","time":"23:55","flight":[{"no":"CX 255","airline":"CPA"}],"origin_dest":["LHR"],"status":"Dep 00:57 (10/12/2025)","gate_baggage":"46","terminal":"T1","isArrival":false,"isCargo":false,"_raw":{"aisle":"BC","hall":""}},{"date":"2025-12-10","time":"23:55","flight":[{"no":"CX 255","airline":"CPA"}],"origin_dest":["LHR"],"status":"Dep 00:00 (11/12/2025)","gate_baggage":"6","terminal":"T1","isArrival":false,"isCargo":false,"_raw":{"aisle":"BC","hall":""}},{"date":"2025-12-11","time":"23:55","flight":[{"no":"CX 255","airline":"CPA"}],"origin_dest":["LHR"],"status":"Dep 00:14 (12/12/2025)","gate_baggage":"34","terminal":"T1","isArrival":false,"isCargo":false,"_raw":{"aisle":"BC","hall":""}},{"date":"2025-12-12","time":"23:55","flight":[{"no":"CX 255","airline":"CPA"}],"origin_dest":["LHR"],"status":"Dep 23:59","gate_baggage":"3","terminal":"T1","isArrival":false,"isCargo":false,"_raw":{"aisle":"B","hall":""}},{"date":"2025-12-13","time":"23:55","flight":[{"no":"CX 255","airline":"CPA"}],"origin_dest":["LHR"],"status":"Dep 00:02 (14/12/2025)","gate_baggage":"32","terminal":"T1","isArrival":false,"isCargo":false,"_raw":{"aisle":"BC","hall":""}},{"date":"2025-12-14","time":"23:55","flight":[{"no":"CX 255","airline":"CPA"}],"origin_dest":["LHR"],"status":"Dep 23:53","gate_baggage":"27","terminal":"T1","isArrival":false,"isCargo":false,"_raw":{"aisle":"B","hall":""}},{"date":"2025-12-15","time":"23:55","flight":[{"no":"CX 255","airline":"CPA"}],"origin_dest":["LHR"],"status":"Dep 00:44 (16/12/2025)","gate_baggage":"48","terminal":"T1","isArrival":false,"isCargo":false,"_raw":{"aisle":"BC","hall":""}},{"date":"2025-12-16","time":"23:55","flight":[{"no":"CX 255","airline":"CPA"}],"origin_dest":["LHR"],"status":"Dep 00:27 (17/12/2025)","gate_baggage":"66","terminal":"T1","isArrival":false,"isCargo":false,"_raw":{"aisle":"C","hall":""}},{"date":"2025-12-17","time":"23:55","flight":[{"no":"CX 255","airline":"CPA"}],"origin_dest":["LHR"],"status":"Dep 00:03 (18/12/2025)","gate_baggage":"69","terminal":"T1","isArrival":false,"isCargo":false,"_raw":{"aisle":"BC","hall":""}},{"date":"2025-12-18","time":"23:55","flight":[{"no":"CX 255","airline":"CPA"}],"origin_dest":["LHR"],"status":"Dep 00:08 (19/12/2025)","gate_baggage":"45","terminal":"T1","isArrival":false,"isCargo":false,"_raw":{"aisle":"BC","hall":""}},{"date":"2025-12-19","time":"23:55","flight":[{"no":"CX 255","airline":"CPA"}],"origin_dest":["LHR"],"status":"Dep 00:04 (20/12/2025)","gate_baggage":"48","terminal":"T1","isArrival":false,"isCargo":false,"_raw":{"aisle":"BC","hall":""}},{"date":"2025-12-20","time":"23:55","flight":[{"no":"CX 255","airline":"CPA"}],"origin_dest":["LHR"],"status":"Dep 00:10 (21/12/2025)","gate_baggage":"42","terminal":"T1","isArrival":false,"isCargo":false,"_raw":{"aisle":"BC","hall":""}},{"date":"2025-12-21","time":"23:55","flight":[{"no":"CX 255","airline":"CPA"}],"origin_dest":["LHR"],"status":"Dep 00:16 (22/12/2025)","gate_baggage":"30","terminal":"T1","isArrival":false,"isCargo":false,"_raw":{"aisle":"BC","hall":""}},{"date":"2025-12-22","time":"23:55","flight":[{"no":"CX 255","airline":"CPA"}],"origin_dest":["LHR"],"status":"Dep 00:06 (23/12/2025)","gate_baggage":"49","terminal":"T1","isArrival":false,"isCargo":false,"_raw":{"aisle":"C","hall":""}},{"date":"2025-12-23","time":"23:55","flight":[{"no":"CX 255","airline":"CPA"}],"origin_dest":["LHR"],"status":"Dep 00:05 (24/12/2025)","gate_baggage":"49","terminal":"T1","isArrival":false,"isCargo":false,"_raw":{"aisle":"BC","hall":""}},{"date":"2025-12-24","time":"23:55","flight":[{"no":"CX 255","airline":"CPA"}],"origin_dest":["LHR"],"status":"Dep 01:00 (25/12/2025)","gate_baggage":"45","terminal":"T1","isArrival":false,"isCargo":false,"_raw":{"aisle":"BC","hall":""}},{"date":"2025-12-25","time":"23:55","flight":[{"no":"CX 255","airline":"CPA"}],"origin_dest":["LHR"],"status":"Dep 00:00 (26/12/2025)","gate_baggage":"1","terminal":"T1","isArrival":false,"isCargo":false,"_raw":{"aisle":"BC","hall":""}},{"date":"2025-12-26","time":"23:55","flight":[{"no":"CX 255","airline":"CPA"}],"origin_dest":["LHR"],"status":"Dep 23:59","gate_baggage":"8","terminal":"T1","isArrival":false,"isCargo":false,"_raw":{"aisle":"C","hall":""}},{"date":"2025-12-27","time":"23:55","flight":[{"no":"CX 255","airline":"CPA"}],"origin_dest":["LHR"],"status":"Dep 00:02 (28/12/2025)","gate_baggage":"9","terminal":"T1","isArrival":false,"isCargo":false,"_raw":{"aisle":"C","hall":""}},{"date":"2025-12-28","time":"23:55","flight":[{"no":"CX 255","airline":"CPA"}],"origin_dest":["LHR"],"status":"Dep 23:58","gate_baggage":"25","terminal":"T1","isArrival":false,"isCargo":false,"_raw":{"aisle":"B","hall":""}},{"date":"2025-12-29","time":"23:55","flight":[{"no":"CX 255","airline":"CPA"}],"origin_dest":["LHR"],"status":"Dep 00:02 (30/12/2025)","gate_baggage":"1","terminal":"T1","isArrival":false,"isCargo":false,"_raw":{"aisle":"BC","hall":""}},{"date":"2025-12-30","time":"23:55","flight":[{"no":"CX 255","airline":"CPA"}],"origin_dest":["LHR"],"status":"Dep 00:01 (31/12/2025)","gate_baggage":"63","terminal":"T1","isArrival":false,"isCargo":false,"_raw":{"aisle":"BC","hall":""}},{"date":"2025-12-31","time":"23:55","flight":[{"no":"CX 255","airline":"CPA"}],"origin_dest":["LHR"],"status":"Dep 00:25 (01/01/2026)","gate_baggage":"8","terminal":"T1","isArrival":false,"isCargo":false,"_raw":{"aisle":"BC","hall":""}},{"date":"2026-01-01","time":"23:55","flight":[{"no":"CX 255","airline":"CPA"}],"origin_dest":["LHR"],"status":"Dep 23:57","gate_baggage":"47","terminal":"T1","isArrival":false,"isCargo":false,"_raw":{"aisle":"C","hall":""}},{"date":"2026-01-02","time":"23:55","flight":[{"no":"CX 255","airline":"CPA"}],"origin_dest":["LHR"],"status":"Dep 00:24 (03/01/2026)","gate_baggage":"65","terminal":"T1","isArrival":false,"isCargo":false,"_raw":{"aisle":"C","hall":""}},{"date":"2026-01-03","time":"23:55","flight":[{"no":"CX 255","airline":"CPA"}],"origin_dest":["LHR"],"status":"Dep 23:58","gate_baggage":"65","terminal":"T1","isArrival":false,"isCargo":false,"_raw":{"aisle":"BC","hall":""}},{"date":"2026-01-04","time":"23:55","flight":[{"no":"CX 255","airline":"CPA"}],"origin_dest":["LHR"],"status":"Dep 00:57 (05/01/2026)","gate_baggage":"5","terminal":"T1","isArrival":false,"isCargo":false,"_raw":{"aisle":"BC","hall":""}},{"date":"2026-01-05","time":"23:55","flight":[{"no":"CX 255","airline":"CPA"}],"origin_dest":["LHR"],"status":"Dep 00:18 (06/01/2026)","gate_baggage":"50","terminal":"T1","isArrival":false,"isCargo":false,"_raw":{"aisle":"BC","hall":""}},{"date":"2026-01-06","time":"23:55","flight":[{"no":"CX 255","airline":"CPA"}],"origin_dest":["LHR"],"status":"Dep 00:32 (07/01/2026)","gate_baggage":"42","terminal":"T1","isArrival":false,"isCargo":false,"_raw":{"aisle":"BC","hall":""}},{"date":"2026-01-07","time":"23:55","flight":[{"no":"CX 255","airline":"CPA"}],"origin_dest":["LHR"],"status":"Dep 01:08 (08/01/2026)","gate_baggage":"44","terminal":"T1","isArrival":false,"isCargo":false,"_raw":{"aisle":"C","hall":""}},{"date":"2026-01-08","time":"23:55","flight":[{"no":"CX 255","airline":"CPA"}],"origin_dest":["LHR"],"status":"Dep 00:10 (09/01/2026)","gate_baggage":"46","terminal":"T1","isArrival":false,"isCargo":false,"_raw":{"aisle":"BC","hall":""}},{"date":"2026-01-09","time":"23:55","flight":[{"no":"CX 255","airline":"CPA"}],"origin_dest":["LHR"],"status":"Dep 00:04 (10/01/2026)","gate_baggage":"36","terminal":"T1","isArrival":false,"isCargo":false,"_raw":{"aisle":"BC","hall":""}},{"date":"2026-01-10","time":"23:55","flight":[{"no":"CX 255","airline":"CPA"}],"origin_dest":["LHR"],"status":"Dep 00:03 (11/01/2026)","gate_baggage":"46","terminal":"T1","isArrival":false,"isCargo":false,"_raw":{"aisle":"BC","hall":""}},{"date":"2026-01-11","time":"23:55","flight":[{"no":"CX 255","airline":"CPA"}],"origin_dest":["LHR"],"status":"Dep 00:07 (12/01/2026)","gate_baggage":"49","terminal":"T1","isArrival":false,"isCargo":false,"_raw":{"aisle":"BC","hall":""}},{"date":"2026-01-12","time":"23:55","flight":[{"no":"CX 255","airline":"CPA"}],"origin_dest":["LHR"],"status":"Dep 00:17 (13/01/2026)","gate_baggage":"1","terminal":"T1","isArrival":false,"isCargo":false,"_raw":{"aisle":"C","hall":""}},{"date":"2026-01-13","time":"23:55","flight":[{"no":"CX 255","airline":"CPA"}],"origin_dest":["LHR"],"status":"Dep 00:04 (14/01/2026)","gate_baggage":"3","terminal":"T1","isArrival":false,"isCargo":false,"_raw":{"aisle":"BC","hall":""}},{"date":"2026-01-14","time":"23:55","flight":[{"no":"CX 255","airline":"CPA"}],"origin_dest":["LHR"],"status":"Dep 00:07 (15/01/2026)","gate_baggage":"28","terminal":"T1","isArrival":false,"isCargo":false,"_raw":{"aisle":"BC","hall":""}},{"date":"2026-01-15","time":"23:55","flight":[{"no":"CX 255","airline":"CPA"}],"origin_dest":["LHR"],"status":"","gate_baggage":"","terminal":"T1","isArrival":false,"isCargo":false,"_raw":{"aisle":"BC","hall":""}},{"date":"2026-01-16","time":"23:55","flight":[{"no":"CX 255","airline":"CPA"}],"origin_dest":["LHR"],"status":"","gate_baggage":"","terminal":"T1","isArrival":false,"isCargo":false,"_raw":{"aisle":"BC","hall":""}},{"date":"2026-01-17","time":"23:55","flight":[{"no":"CX 255","airline":"CPA"}],"origin_dest":["LHR"],"status":"Dep 00:04 (18/01/2026)","gate_baggage":"50","terminal":"T1","isArrival":false,"isCargo":false,"_raw":{"aisle":"BC","hall":""}},{"date":"2026-01-18","time":"23:55","flight":[{"no":"CX 255","airline":"CPA"}],"origin_dest":["LHR"],"status":"Dep 01:07 (19/01/2026)","gate_baggage":"26","terminal":"T1","isArrival":false,"isCargo":false,"_raw":{"aisle":"BC","hall":""}},{"date":"2026-01-19","time":"23:55","flight":[{"no":"CX 255","airline":"CPA"}],"origin_dest":["LHR"],"status":"Gate Closed","gate_baggage":"67","terminal":"T1","isArrival":false,"isCargo":false,"_raw":{"aisle":"BC","hall":""}}]
