[{"date":"2025-12-17","time":"23:55","flight":[{"no":"CX 587","airline":"CPA"},{"no":"JL 7021","airline":"JAL"}],"origin_dest":["CTS"],"status":"At gate 02:55 (18/12/2025)","gate_baggage":"13","terminal":"","isArrival":true,"isCargo":false,"_raw":{"aisle":"","hall":"B"}},{"date":"2025-12-18","time":"23:55","flight":[{"no":"CX 587","airline":"CPA"},{"no":"JL 7021","airline":"JAL"}],"origin_dest":["CTS"],"status":"At gate 23:51","gate_baggage":"17","terminal":"","isArrival":true,"isCargo":false,"_raw":{"aisle":"","hall":"B"}},{"date":"2025-12-19","time":"23:55","flight":[{"no":"CX 587","airline":"CPA"},{"no":"JL 7021","airline":"JAL"}],"origin_dest":["CTS"],"status":"At gate 00:43 (20/12/2025)","gate_baggage":"12","terminal":"","isArrival":true,"isCargo":false,"_raw":{"aisle":"","hall":"B"}},{"date":"2025-12-20","time":"23:55","flight":[{"no":"CX 587","airline":"CPA"},{"no":"JL 7021","airline":"JAL"}],"origin_dest":["CTS"],"status":"At gate 02:10 (21/12/2025)","gate_baggage":"13","terminal":"","isArrival":true,"isCargo":false,"_raw":{"aisle":"","hall":"B"}},{"date":"2025-12-21","time":"23:55","flight":[{"no":"CX 587","airline":"CPA"},{"no":"JL 7021","airline":"JAL"}],"origin_dest":["CTS"],"status":"At gate 00:53 (22/12/2025)","gate_baggage":"12","terminal":"","isArrival":true,"isCargo":false,"_raw":{"aisle":"","hall":"B"}},{"date":"2025-12-22","time":"23:55","flight":[{"no":"CX 587","airline":"CPA"},{"no":"JL 7021","airline":"JAL"}],"origin_dest":["CTS"],"status":"At gate 00:12 (23/12/2025)","gate_baggage":"9","terminal":"","isArrival":true,"isCargo":false,"_raw":{"aisle":"","hall":"A"}},{"date":"2025-12-23","time":"23:55","flight":[{"no":"CX 587","airline":"CPA"},{"no":"JL 7021","airline":"JAL"}],"origin_dest":["CTS"],"status":"At gate 23:21","gate_baggage":"9","terminal":"","isArrival":true,"isCargo":false,"_raw":{"aisle":"","hall":"A"}},{"date":"2025-12-24","time":"23:55","flight":[{"no":"CX 587","airline":"CPA"},{"no":"JL 7021","airline":"JAL"}],"origin_dest":["CTS"],"status":"At gate 00:01 (25/12/2025)","gate_baggage":"13","terminal":"","isArrival":true,"isCargo":false,"_raw":{"aisle":"","hall":"B"}},{"date":"2025-12-25","time":"23:55","flight":[{"no":"CX 587","airline":"CPA"},{"no":"JL 7021","airline":"JAL"}],"origin_dest":["CTS"],"status":"At gate 00:10 (26/12/2025)","gate_baggage":"16","terminal":"","isArrival":true,"isCargo":false,"_raw":{"aisle":"","hall":"B"}},{"date":"2025-12-26","time":"23:55","flight":[{"no":"CX 587","airline":"CPA"},{"no":"JL 7021","airline":"JAL"}],"origin_dest":["CTS"],"status":"At gate 00:16 (27/12/2025)","gate_baggage":"13","terminal":"","isArrival":true,"isCargo":false,"_raw":{"aisle":"","hall":"B"}},{"date":"2025-12-27","time":"23:55","flight":[{"no":"CX 587","airline":"CPA"},{"no":"JL 7021","airline":"JAL"}],"origin_dest":["CTS"],"status":"At gate 23:45","gate_baggage":"17","terminal":"","isArrival":true,"isCargo":false,"_raw":{"aisle":"","hall":"B"}},{"date":"2025-12-28","time":"23:55","flight":[{"no":"CX 587","airline":"CPA"},{"no":"JL 7021","airline":"JAL"}],"origin_dest":["CTS"],"status":"At gate 00:06 (29/12/2025)","gate_baggage":"12","terminal":"","isArrival":true,"isCargo":false,"_raw":{"aisle":"","hall":"B"}},{"date":"2025-12-29","time":"23:55","flight":[{"no":"CX 587","airline":"CPA"},{"no":"JL 7021","airline":"JAL"}],"origin_dest":["CTS"],"status":"At gate 23:53","gate_baggage":"5","terminal":"","isArrival":true,"isCargo":false,"_raw":{"aisle":"","hall":"A"}},{"date":"2025-12-30","time":"23:55","flight":[{"no":"CX 587","airline":"CPA"},{"no":"JL 7021","airline":"JAL"}],"origin_dest":["CTS"],"status":"At gate 00:49 (31/12/2025)","gate_baggage":"16","terminal":"","isArrival":true,"isCargo":false,"_raw":{"aisle":"","hall":"B"}},{"date":"2025-12-31","time":"23:55","flight":[{"no":"CX 587","airline":"CPA"},{"no":"JL 7021","airline":"JAL"}],"origin_dest":["CTS"],"status":"At gate 00:05 (01/01/2026)","gate_baggage":"13","terminal":"","isArrival":true,"isCargo":false,"_raw":{"aisle":"","hall":"B"}},{"date":"2026-01-01","time":"23:55","flight":[{"no":"CX 587","airline":"CPA"},{"no":"JL 7021","airline":"JAL"}],"origin_dest":["CTS"],"status":"At gate 23:53","gate_baggage":"17","terminal":"","isArrival":true,"isCargo":false,"_raw":{"aisle":"","hall":"B"}},{"date":"2026-01-02","time":"23:55","flight":[{"no":"CX 587","airline":"CPA"},{"no":"JL 7021","airline":"JAL"}],"origin_dest":["CTS"],"status":"At gate 00:36 (03/01/2026)","gate_baggage":"12","terminal":"","isArrival":true,"isCargo":false,"_raw":{"aisle":"","hall":"B"}},{"date":"2026-01-03","time":"23:55","flight":[{"no":"CX 587","airline":"CPA"},{"no":"JL 7021","airline":"JAL"}],"origin_dest":["CTS"],"status":"At gate 01:38 (04/01/2026)","gate_baggage":"16","terminal":"","isArrival":true,"isCargo":false,"_raw":{"aisle":"","hall":"B"}},{"date":"2026-01-04","time":"23:55","flight":[{"no":"CX 587","airline":"CPA"},{"no":"JL 7021","airline":"JAL"}],"origin_dest":["CTS"],"status":"At gate 00:00 (05/01/2026)","gate_baggage":"13","terminal":"","isArrival":true,"isCargo":false,"_raw":{"aisle":"","hall":"B"}},{"date":"2026-01-05","time":"23:55","flight":[{"no":"CX 587","airline":"CPA"},{"no":"JL 7021","airline":"JAL"}],"origin_dest":["CTS"],"status":"At gate 00:17 (06/01/2026)","gate_baggage":"16","terminal":"","isArrival":true,"isCargo":false,"_raw":{"aisle":"","hall":"B"}},{"date":"2026-01-06","time":"23:55","flight":[{"no":"CX 587","airline":"CPA"},{"no":"JL 7021","airline":"JAL"}],"origin_dest":["CTS"],"status":"At gate 23:52","gate_baggage":"17","terminal":"","isArrival":true,"isCargo":false,"_raw":{"aisle":"","hall":"B"}},{"date":"2026-01-07","time":"23:55","flight":[{"no":"CX 587","airline":"CPA"},{"no":"JL 7021","airline":"JAL"}],"origin_dest":["CTS"],"status":"At gate 04:08 (08/01/2026)","gate_baggage":"12","terminal":"","isArrival":true,"isCargo":false,"_raw":{"aisle":"","hall":"B"}},{"date":"2026-01-08","time":"23:55","flight":[{"no":"CX 587","airline":"CPA"},{"no":"JL 7021","airline":"JAL"}],"origin_dest":["CTS"],"status":"At gate 01:13 (09/01/2026)","gate_baggage":"17","terminal":"","isArrival":true,"isCargo":false,"_raw":{"aisle":"","hall":"B"}},{"date":"2026-01-09","time":"23:55","flight":[{"no":"CX 587","airline":"CPA"},{"no":"JL 7021","airline":"JAL"}],"origin_dest":["CTS"],"status":"At gate 00:06 (10/01/2026)","gate_baggage":"13","terminal":"","isArrival":true,"isCargo":false,"_raw":{"aisle":"","hall":"B"}},{"date":"2026-01-10","time":"23:55","flight":[{"no":"CX 587","airline":"CPA"},{"no":"JL 7021","airline":"JAL"}],"origin_dest":["CTS"],"status":"At gate 00:20 (11/01/2026)","gate_baggage":"13","terminal":"","isArrival":true,"isCargo":false,"_raw":{"aisle":"","hall":"B"}},{"date":"2026-01-11","time":"23:55","flight":[{"no":"CX 587","airline":"CPA"},{"no":"JL 7021","airline":"JAL"}],"origin_dest":["CTS"],"status":"At gate 00:14 (12/01/2026)","gate_baggage":"17","terminal":"","isArrival":true,"isCargo":false,"_raw":{"aisle":"","hall":"B"}},{"date":"2026-01-12","time":"23:55","flight":[{"no":"CX 587","airline":"CPA"},{"no":"JL 7021","airline":"JAL"}],"origin_dest":["CTS"],"status":"At gate 00:26 (13/01/2026)","gate_baggage":"17","terminal":"","isArrival":true,"isCargo":false,"_raw":{"aisle":"","hall":"B"}},{"date":"2026-01-13","time":"23:55","flight":[{"no":"CX 587","airline":"CPA"},{"no":"JL 7021","airline":"JAL"}],"origin_dest":["CTS"],"status":"At gate 05:30 (14/01/2026)","gate_baggage":"17","terminal":"","isArrival":true,"isCargo":false,"_raw":{"aisle":"","hall":"B"}},{"date":"2026-01-14","time":"23:55","flight":[{"no":"CX 587","airline":"CPA"},{"no":"JL 7021","airline":"JAL"}],"origin_dest":["CTS"],"status":"At gate 00:08 (15/01/2026)","gate_baggage":"13","terminal":"","isArrival":true,"isCargo":false,"_raw":{"aisle":"","hall":"B"}},{"date":"2026-01-15","time":"23:55","flight":[{"no":"CX 587","airline":"CPA"},{"no":"JL 7021","airline":"JAL"}],"origin_dest":["CTS"],"status":"","gate_baggage":"","terminal":"","isArrival":true,"isCargo":false,"_raw":{"aisle":"","hall":""}},{"date":"2026-01-16","time":"23:55","flight":[{"no":"CX 587","airline":"CPA"},{"no":"JL 7021","airline":"JAL"}],"origin_dest":["CTS"],"status":"","gate_baggage":"","terminal":"","isArrival":true,"isCargo":false,"_raw":{"aisle":"","hall":""}}]