[{"date":"2025-12-01","time":"23:50","flight":[{"no":"MH 078","airline":"MAS"},{"no":"CX 6010","airline":"CPA"},{"no":"FY 7052","airline":"FFM"},{"no":"UL 2778","airline":"ALK"},{"no":"QR 4986","airline":"QTR"}],"origin_dest":["KUL"],"status":"At gate 23:46","gate_baggage":"9","terminal":"","isArrival":true,"isCargo":false,"_raw":{"aisle":"","hall":"A"}},{"date":"2025-12-02","time":"23:50","flight":[{"no":"MH 078","airline":"MAS"},{"no":"CX 6010","airline":"CPA"},{"no":"FY 7052","airline":"FFM"},{"no":"UL 2778","airline":"ALK"},{"no":"QR 4986","airline":"QTR"}],"origin_dest":["KUL"],"status":"At gate 00:07 (03/12/2025)","gate_baggage":"5","terminal":"","isArrival":true,"isCargo":false,"_raw":{"aisle":"","hall":"A"}},{"date":"2025-12-03","time":"23:50","flight":[{"no":"MH 078","airline":"MAS"},{"no":"CX 6010","airline":"CPA"},{"no":"FY 7052","airline":"FFM"},{"no":"UL 2778","airline":"ALK"},{"no":"QR 4986","airline":"QTR"}],"origin_dest":["KUL"],"status":"At gate 23:55","gate_baggage":"10","terminal":"","isArrival":true,"isCargo":false,"_raw":{"aisle":"","hall":"A"}},{"date":"2025-12-04","time":"23:50","flight":[{"no":"MH 078","airline":"MAS"},{"no":"CX 6010","airline":"CPA"},{"no":"FY 7052","airline":"FFM"},{"no":"UL 2778","airline":"ALK"},{"no":"QR 4986","airline":"QTR"}],"origin_dest":["KUL"],"status":"At gate 00:10 (05/12/2025)","gate_baggage":"8","terminal":"","isArrival":true,"isCargo":false,"_raw":{"aisle":"","hall":"A"}},{"date":"2025-12-05","time":"23:50","flight":[{"no":"MH 078","airline":"MAS"},{"no":"CX 6010","airline":"CPA"},{"no":"FY 7052","airline":"FFM"},{"no":"UL 2778","airline":"ALK"},{"no":"QR 4986","airline":"QTR"}],"origin_dest":["KUL"],"status":"At gate 00:02 (06/12/2025)","gate_baggage":"12","terminal":"","isArrival":true,"isCargo":false,"_raw":{"aisle":"","hall":"B"}},{"date":"2025-12-06","time":"23:50","flight":[{"no":"MH 078","airline":"MAS"},{"no":"CX 6010","airline":"CPA"},{"no":"FY 7052","airline":"FFM"},{"no":"UL 2778","airline":"ALK"},{"no":"QR 4986","airline":"QTR"}],"origin_dest":["KUL"],"status":"At gate 23:45","gate_baggage":"12","terminal":"","isArrival":true,"isCargo":false,"_raw":{"aisle":"","hall":"B"}},{"date":"2025-12-07","time":"23:50","flight":[{"no":"MH 078","airline":"MAS"},{"no":"CX 6010","airline":"CPA"},{"no":"FY 7052","airline":"FFM"},{"no":"UL 2778","airline":"ALK"},{"no":"QR 4986","airline":"QTR"}],"origin_dest":["KUL"],"status":"At gate 23:39","gate_baggage":"13","terminal":"","isArrival":true,"isCargo":false,"_raw":{"aisle":"","hall":"B"}},{"date":"2025-12-08","time":"23:50","flight":[{"no":"MH 078","airline":"MAS"},{"no":"CX 6010","airline":"CPA"},{"no":"FY 7052","airline":"FFM"},{"no":"UL 2778","airline":"ALK"},{"no":"QR 4986","airline":"QTR"}],"origin_dest":["KUL"],"status":"At gate 23:39","gate_baggage":"12","terminal":"","isArrival":true,"isCargo":false,"_raw":{"aisle":"","hall":"B"}},{"date":"2025-12-09","time":"23:50","flight":[{"no":"MH 078","airline":"MAS"},{"no":"CX 6010","airline":"CPA"},{"no":"FY 7052","airline":"FFM"},{"no":"UL 2778","airline":"ALK"},{"no":"QR 4986","airline":"QTR"}],"origin_dest":["KUL"],"status":"At gate 23:51","gate_baggage":"13","terminal":"","isArrival":true,"isCargo":false,"_raw":{"aisle":"","hall":"B"}},{"date":"2025-12-10","time":"23:50","flight":[{"no":"MH 078","airline":"MAS"},{"no":"CX 6010","airline":"CPA"},{"no":"FY 7052","airline":"FFM"},{"no":"UL 2778","airline":"ALK"},{"no":"QR 4986","airline":"QTR"}],"origin_dest":["KUL"],"status":"At gate 23:44","gate_baggage":"12","terminal":"","isArrival":true,"isCargo":false,"_raw":{"aisle":"","hall":"B"}},{"date":"2025-12-11","time":"23:50","flight":[{"no":"MH 078","airline":"MAS"},{"no":"CX 6010","airline":"CPA"},{"no":"FY 7052","airline":"FFM"},{"no":"UL 2778","airline":"ALK"},{"no":"QR 4986","airline":"QTR"}],"origin_dest":["KUL"],"status":"At gate 23:50","gate_baggage":"13","terminal":"","isArrival":true,"isCargo":false,"_raw":{"aisle":"","hall":"B"}},{"date":"2025-12-12","time":"23:50","flight":[{"no":"MH 078","airline":"MAS"},{"no":"CX 6010","airline":"CPA"},{"no":"FY 7052","airline":"FFM"},{"no":"UL 2778","airline":"ALK"},{"no":"QR 4986","airline":"QTR"}],"origin_dest":["KUL"],"status":"At gate 23:52","gate_baggage":"13","terminal":"","isArrival":true,"isCargo":false,"_raw":{"aisle":"","hall":"B"}},{"date":"2025-12-13","time":"23:50","flight":[{"no":"MH 078","airline":"MAS"},{"no":"CX 6010","airline":"CPA"},{"no":"FY 7052","airline":"FFM"},{"no":"UL 2778","airline":"ALK"},{"no":"QR 4986","airline":"QTR"}],"origin_dest":["KUL"],"status":"At gate 00:12 (14/12/2025)","gate_baggage":"17","terminal":"","isArrival":true,"isCargo":false,"_raw":{"aisle":"","hall":"B"}},{"date":"2025-12-14","time":"23:50","flight":[{"no":"MH 078","airline":"MAS"},{"no":"CX 6010","airline":"CPA"},{"no":"FY 7052","airline":"FFM"},{"no":"UL 2778","airline":"ALK"},{"no":"QR 4986","airline":"QTR"}],"origin_dest":["KUL"],"status":"At gate 00:24 (15/12/2025)","gate_baggage":"12","terminal":"","isArrival":true,"isCargo":false,"_raw":{"aisle":"","hall":"B"}},{"date":"2025-12-15","time":"23:50","flight":[{"no":"MH 078","airline":"MAS"},{"no":"CX 6010","airline":"CPA"},{"no":"FY 7052","airline":"FFM"},{"no":"UL 2778","airline":"ALK"},{"no":"QR 4986","airline":"QTR"}],"origin_dest":["KUL"],"status":"At gate 23:39","gate_baggage":"13","terminal":"","isArrival":true,"isCargo":false,"_raw":{"aisle":"","hall":"B"}},{"date":"2025-12-16","time":"23:50","flight":[{"no":"MH 078","airline":"MAS"},{"no":"CX 6010","airline":"CPA"},{"no":"FY 7052","airline":"FFM"},{"no":"UL 2778","airline":"ALK"},{"no":"QR 4986","airline":"QTR"}],"origin_dest":["KUL"],"status":"At gate 00:37 (17/12/2025)","gate_baggage":"13","terminal":"","isArrival":true,"isCargo":false,"_raw":{"aisle":"","hall":"B"}},{"date":"2025-12-17","time":"23:50","flight":[{"no":"MH 078","airline":"MAS"},{"no":"CX 6010","airline":"CPA"},{"no":"FY 7052","airline":"FFM"},{"no":"UL 2778","airline":"ALK"},{"no":"QR 4986","airline":"QTR"}],"origin_dest":["KUL"],"status":"At gate 23:40","gate_baggage":"16","terminal":"","isArrival":true,"isCargo":false,"_raw":{"aisle":"","hall":"B"}},{"date":"2025-12-19","time":"23:50","flight":[{"no":"MH 078","airline":"MAS"},{"no":"CX 6010","airline":"CPA"},{"no":"FY 7052","airline":"FFM"},{"no":"UL 2778","airline":"ALK"},{"no":"QR 4986","airline":"QTR"}],"origin_dest":["KUL"],"status":"At gate 00:09 (20/12/2025)","gate_baggage":"17","terminal":"","isArrival":true,"isCargo":false,"_raw":{"aisle":"","hall":"B"}},{"date":"2025-12-20","time":"23:50","flight":[{"no":"MH 078","airline":"MAS"},{"no":"CX 6010","airline":"CPA"},{"no":"FY 7052","airline":"FFM"},{"no":"UL 2778","airline":"ALK"},{"no":"QR 4986","airline":"QTR"}],"origin_dest":["KUL"],"status":"At gate 23:59","gate_baggage":"13","terminal":"","isArrival":true,"isCargo":false,"_raw":{"aisle":"","hall":"B"}},{"date":"2025-12-21","time":"23:50","flight":[{"no":"MH 078","airline":"MAS"},{"no":"CX 6010","airline":"CPA"},{"no":"FY 7052","airline":"FFM"},{"no":"UL 2778","airline":"ALK"},{"no":"QR 4986","airline":"QTR"}],"origin_dest":["KUL"],"status":"At gate 00:23 (22/12/2025)","gate_baggage":"13","terminal":"","isArrival":true,"isCargo":false,"_raw":{"aisle":"","hall":"B"}},{"date":"2025-12-22","time":"23:50","flight":[{"no":"MH 078","airline":"MAS"},{"no":"CX 6010","airline":"CPA"},{"no":"FY 7052","airline":"FFM"},{"no":"UL 2778","airline":"ALK"},{"no":"QR 4986","airline":"QTR"}],"origin_dest":["KUL"],"status":"At gate 23:49","gate_baggage":"9","terminal":"","isArrival":true,"isCargo":false,"_raw":{"aisle":"","hall":"A"}},{"date":"2025-12-23","time":"23:50","flight":[{"no":"MH 078","airline":"MAS"},{"no":"CX 6010","airline":"CPA"},{"no":"FY 7052","airline":"FFM"},{"no":"UL 2778","airline":"ALK"},{"no":"QR 4986","airline":"QTR"}],"origin_dest":["KUL"],"status":"At gate 00:19 (24/12/2025)","gate_baggage":"10","terminal":"","isArrival":true,"isCargo":false,"_raw":{"aisle":"","hall":"A"}},{"date":"2025-12-24","time":"23:50","flight":[{"no":"MH 078","airline":"MAS"},{"no":"CX 6010","airline":"CPA"},{"no":"FY 7052","airline":"FFM"},{"no":"UL 2778","airline":"ALK"},{"no":"QR 4986","airline":"QTR"}],"origin_dest":["KUL"],"status":"At gate 00:05 (25/12/2025)","gate_baggage":"17","terminal":"","isArrival":true,"isCargo":false,"_raw":{"aisle":"","hall":"B"}},{"date":"2025-12-25","time":"23:50","flight":[{"no":"MH 078","airline":"MAS"},{"no":"CX 6010","airline":"CPA"},{"no":"FY 7052","airline":"FFM"},{"no":"UL 2778","airline":"ALK"},{"no":"QR 4986","airline":"QTR"}],"origin_dest":["KUL"],"status":"At gate 23:50","gate_baggage":"12","terminal":"","isArrival":true,"isCargo":false,"_raw":{"aisle":"","hall":"B"}},{"date":"2025-12-26","time":"23:50","flight":[{"no":"MH 078","airline":"MAS"},{"no":"CX 6010","airline":"CPA"},{"no":"FY 7052","airline":"FFM"},{"no":"UL 2778","airline":"ALK"},{"no":"QR 4986","airline":"QTR"}],"origin_dest":["KUL"],"status":"At gate 23:58","gate_baggage":"17","terminal":"","isArrival":true,"isCargo":false,"_raw":{"aisle":"","hall":"B"}},{"date":"2025-12-27","time":"23:50","flight":[{"no":"MH 078","airline":"MAS"},{"no":"CX 6010","airline":"CPA"},{"no":"FY 7052","airline":"FFM"},{"no":"UL 2778","airline":"ALK"},{"no":"QR 4986","airline":"QTR"}],"origin_dest":["KUL"],"status":"At gate 23:50","gate_baggage":"12","terminal":"","isArrival":true,"isCargo":false,"_raw":{"aisle":"","hall":"B"}},{"date":"2025-12-28","time":"23:50","flight":[{"no":"MH 078","airline":"MAS"},{"no":"CX 6010","airline":"CPA"},{"no":"FY 7052","airline":"FFM"},{"no":"UL 2778","airline":"ALK"},{"no":"QR 4986","airline":"QTR"}],"origin_dest":["KUL"],"status":"At gate 23:59","gate_baggage":"12","terminal":"","isArrival":true,"isCargo":false,"_raw":{"aisle":"","hall":"B"}},{"date":"2025-12-29","time":"23:50","flight":[{"no":"MH 078","airline":"MAS"},{"no":"CX 6010","airline":"CPA"},{"no":"FY 7052","airline":"FFM"},{"no":"UL 2778","airline":"ALK"},{"no":"QR 4986","airline":"QTR"}],"origin_dest":["KUL"],"status":"At gate 23:45","gate_baggage":"8","terminal":"","isArrival":true,"isCargo":false,"_raw":{"aisle":"","hall":"A"}},{"date":"2025-12-30","time":"23:50","flight":[{"no":"MH 078","airline":"MAS"},{"no":"CX 6010","airline":"CPA"},{"no":"FY 7052","airline":"FFM"},{"no":"UL 2778","airline":"ALK"},{"no":"QR 4986","airline":"QTR"}],"origin_dest":["KUL"],"status":"At gate 23:58","gate_baggage":"12","terminal":"","isArrival":true,"isCargo":false,"_raw":{"aisle":"","hall":"B"}},{"date":"2025-12-31","time":"23:50","flight":[{"no":"MH 078","airline":"MAS"},{"no":"CX 6010","airline":"CPA"},{"no":"FY 7052","airline":"FFM"},{"no":"UL 2778","airline":"ALK"},{"no":"QR 4986","airline":"QTR"}],"origin_dest":["KUL"],"status":"At gate 23:57","gate_baggage":"12","terminal":"","isArrival":true,"isCargo":false,"_raw":{"aisle":"","hall":"B"}},{"date":"2026-01-01","time":"23:50","flight":[{"no":"MH 078","airline":"MAS"},{"no":"CX 6010","airline":"CPA"},{"no":"FY 7052","airline":"FFM"},{"no":"UL 2778","airline":"ALK"},{"no":"QR 4986","airline":"QTR"}],"origin_dest":["KUL"],"status":"At gate 23:34","gate_baggage":"12","terminal":"","isArrival":true,"isCargo":false,"_raw":{"aisle":"","hall":"B"}},{"date":"2026-01-02","time":"23:50","flight":[{"no":"MH 078","airline":"MAS"},{"no":"CX 6010","airline":"CPA"},{"no":"FY 7052","airline":"FFM"},{"no":"UL 2778","airline":"ALK"},{"no":"QR 4986","airline":"QTR"}],"origin_dest":["KUL"],"status":"At gate 23:48","gate_baggage":"13","terminal":"","isArrival":true,"isCargo":false,"_raw":{"aisle":"","hall":"B"}},{"date":"2026-01-03","time":"23:50","flight":[{"no":"MH 078","airline":"MAS"},{"no":"CX 6010","airline":"CPA"},{"no":"FY 7052","airline":"FFM"},{"no":"UL 2778","airline":"ALK"},{"no":"QR 4986","airline":"QTR"}],"origin_dest":["KUL"],"status":"At gate 23:36","gate_baggage":"12","terminal":"","isArrival":true,"isCargo":false,"_raw":{"aisle":"","hall":"B"}},{"date":"2026-01-04","time":"23:50","flight":[{"no":"MH 078","airline":"MAS"},{"no":"CX 6010","airline":"CPA"},{"no":"FY 7052","airline":"FFM"},{"no":"UL 2778","airline":"ALK"},{"no":"QR 4986","airline":"QTR"}],"origin_dest":["KUL"],"status":"At gate 23:51","gate_baggage":"12","terminal":"","isArrival":true,"isCargo":false,"_raw":{"aisle":"","hall":"B"}},{"date":"2026-01-05","time":"23:50","flight":[{"no":"MH 078","airline":"MAS"},{"no":"CX 6010","airline":"CPA"},{"no":"FY 7052","airline":"FFM"},{"no":"UL 2778","airline":"ALK"},{"no":"QR 4986","airline":"QTR"}],"origin_dest":["KUL"],"status":"At gate 23:38","gate_baggage":"13","terminal":"","isArrival":true,"isCargo":false,"_raw":{"aisle":"","hall":"B"}},{"date":"2026-01-06","time":"23:50","flight":[{"no":"MH 078","airline":"MAS"},{"no":"CX 6010","airline":"CPA"},{"no":"FY 7052","airline":"FFM"},{"no":"UL 2778","airline":"ALK"},{"no":"QR 4986","airline":"QTR"}],"origin_dest":["KUL"],"status":"At gate 00:01 (07/01/2026)","gate_baggage":"12","terminal":"","isArrival":true,"isCargo":false,"_raw":{"aisle":"","hall":"B"}},{"date":"2026-01-07","time":"23:50","flight":[{"no":"MH 078","airline":"MAS"},{"no":"CX 6010","airline":"CPA"},{"no":"FY 7052","airline":"FFM"},{"no":"UL 2778","airline":"ALK"},{"no":"QR 4986","airline":"QTR"}],"origin_dest":["KUL"],"status":"At gate 23:53","gate_baggage":"13","terminal":"","isArrival":true,"isCargo":false,"_raw":{"aisle":"","hall":"B"}},{"date":"2026-01-08","time":"23:50","flight":[{"no":"MH 078","airline":"MAS"},{"no":"CX 6010","airline":"CPA"},{"no":"FY 7052","airline":"FFM"},{"no":"UL 2778","airline":"ALK"},{"no":"QR 4986","airline":"QTR"}],"origin_dest":["KUL"],"status":"At gate 23:51","gate_baggage":"16","terminal":"","isArrival":true,"isCargo":false,"_raw":{"aisle":"","hall":"B"}},{"date":"2026-01-09","time":"23:50","flight":[{"no":"MH 078","airline":"MAS"},{"no":"CX 6010","airline":"CPA"},{"no":"FY 7052","airline":"FFM"},{"no":"UL 2778","airline":"ALK"},{"no":"QR 4986","airline":"QTR"}],"origin_dest":["KUL"],"status":"At gate 00:00 (10/01/2026)","gate_baggage":"16","terminal":"","isArrival":true,"isCargo":false,"_raw":{"aisle":"","hall":"B"}},{"date":"2026-01-10","time":"23:50","flight":[{"no":"MH 078","airline":"MAS"},{"no":"CX 6010","airline":"CPA"},{"no":"FY 7052","airline":"FFM"},{"no":"UL 2778","airline":"ALK"},{"no":"QR 4986","airline":"QTR"}],"origin_dest":["KUL"],"status":"At gate 23:50","gate_baggage":"17","terminal":"","isArrival":true,"isCargo":false,"_raw":{"aisle":"","hall":"B"}},{"date":"2026-01-11","time":"23:50","flight":[{"no":"MH 078","airline":"MAS"},{"no":"CX 6010","airline":"CPA"},{"no":"FY 7052","airline":"FFM"},{"no":"UL 2778","airline":"ALK"},{"no":"QR 4986","airline":"QTR"}],"origin_dest":["KUL"],"status":"At gate 23:44","gate_baggage":"16","terminal":"","isArrival":true,"isCargo":false,"_raw":{"aisle":"","hall":"B"}},{"date":"2026-01-12","time":"23:50","flight":[{"no":"MH 078","airline":"MAS"},{"no":"CX 6010","airline":"CPA"},{"no":"FY 7052","airline":"FFM"},{"no":"UL 2778","airline":"ALK"},{"no":"QR 4986","airline":"QTR"}],"origin_dest":["KUL"],"status":"At gate 23:59","gate_baggage":"13","terminal":"","isArrival":true,"isCargo":false,"_raw":{"aisle":"","hall":"B"}},{"date":"2026-01-13","time":"23:50","flight":[{"no":"MH 078","airline":"MAS"},{"no":"CX 6010","airline":"CPA"},{"no":"FY 7052","airline":"FFM"},{"no":"UL 2778","airline":"ALK"},{"no":"QR 4986","airline":"QTR"}],"origin_dest":["KUL"],"status":"At gate 23:41","gate_baggage":"13","terminal":"","isArrival":true,"isCargo":false,"_raw":{"aisle":"","hall":"B"}},{"date":"2026-01-14","time":"23:50","flight":[{"no":"MH 078","airline":"MAS"},{"no":"CX 6010","airline":"CPA"},{"no":"FY 7052","airline":"FFM"},{"no":"UL 2778","airline":"ALK"},{"no":"QR 4986","airline":"QTR"}],"origin_dest":["KUL"],"status":"At gate 23:52","gate_baggage":"16","terminal":"","isArrival":true,"isCargo":false,"_raw":{"aisle":"","hall":"B"}},{"date":"2026-01-15","time":"23:50","flight":[{"no":"MH 078","airline":"MAS"},{"no":"CX 6010","airline":"CPA"},{"no":"FY 7052","airline":"FFM"},{"no":"UL 2778","airline":"ALK"},{"no":"QR 4986","airline":"QTR"}],"origin_dest":["KUL"],"status":"","gate_baggage":"","terminal":"","isArrival":true,"isCargo":false,"_raw":{"aisle":"","hall":""}},{"date":"2026-01-16","time":"23:50","flight":[{"no":"MH 078","airline":"MAS"},{"no":"CX 6010","airline":"CPA"},{"no":"FY 7052","airline":"FFM"},{"no":"UL 2778","airline":"ALK"},{"no":"QR 4986","airline":"QTR"}],"origin_dest":["KUL"],"status":"","gate_baggage":"","terminal":"","isArrival":true,"isCargo":false,"_raw":{"aisle":"","hall":""}},{"date":"2026-01-17","time":"23:50","flight":[{"no":"MH 078","airline":"MAS"},{"no":"CX 6010","airline":"CPA"},{"no":"FY 7052","airline":"FFM"},{"no":"UL 2778","airline":"ALK"},{"no":"QR 4986","airline":"QTR"}],"origin_dest":["KUL"],"status":"At gate 23:46","gate_baggage":"13","terminal":"","isArrival":true,"isCargo":false,"_raw":{"aisle":"","hall":"B"}},{"date":"2026-01-18","time":"23:50","flight":[{"no":"MH 078","airline":"MAS"},{"no":"CX 6010","airline":"CPA"},{"no":"FY 7052","airline":"FFM"},{"no":"UL 2778","airline":"ALK"},{"no":"QR 4986","airline":"QTR"}],"origin_dest":["KUL"],"status":"At gate 23:55","gate_baggage":"13","terminal":"","isArrival":true,"isCargo":false,"_raw":{"aisle":"","hall":"B"}},{"date":"2026-01-19","time":"23:50","flight":[{"no":"MH 078","airline":"MAS"},{"no":"CX 6010","airline":"CPA"},{"no":"FY 7052","airline":"FFM"},{"no":"UL 2778","airline":"ALK"},{"no":"QR 4986","airline":"QTR"}],"origin_dest":["KUL"],"status":"At gate 23:38","gate_baggage":"12","terminal":"","isArrival":true,"isCargo":false,"_raw":{"aisle":"","hall":"B"}},{"date":"2026-01-20","time":"23:50","flight":[{"no":"MH 078","airline":"MAS"},{"no":"CX 6010","airline":"CPA"},{"no":"FY 7052","airline":"FFM"},{"no":"UL 2778","airline":"ALK"},{"no":"QR 4986","airline":"QTR"}],"origin_dest":["KUL"],"status":"At gate 23:35","gate_baggage":"8","terminal":"","isArrival":true,"isCargo":false,"_raw":{"aisle":"","hall":"A"}}]
