[{"date":"2025-11-28","time":"23:40","flight":[{"no":"HX 170","airline":"CRK"},{"no":"HU 8275","airline":"CHH"}],"origin_dest":["SYX"],"status":"At gate 00:33 (29/11/2025)","gate_baggage":"6","terminal":"","isArrival":true,"isCargo":false,"_raw":{"aisle":"","hall":"A"}},{"date":"2025-11-29","time":"23:40","flight":[{"no":"HX 170","airline":"CRK"},{"no":"HU 8275","airline":"CHH"}],"origin_dest":["SYX"],"status":"At gate 00:07 (30/11/2025)","gate_baggage":"6","terminal":"","isArrival":true,"isCargo":false,"_raw":{"aisle":"","hall":"A"}},{"date":"2025-11-30","time":"23:40","flight":[{"no":"HX 170","airline":"CRK"},{"no":"HU 8275","airline":"CHH"}],"origin_dest":["SYX"],"status":"At gate 23:37","gate_baggage":"7","terminal":"","isArrival":true,"isCargo":false,"_raw":{"aisle":"","hall":"A"}},{"date":"2025-12-01","time":"23:40","flight":[{"no":"HX 170","airline":"CRK"},{"no":"HU 8275","airline":"CHH"}],"origin_dest":["SYX"],"status":"At gate 23:30","gate_baggage":"5","terminal":"","isArrival":true,"isCargo":false,"_raw":{"aisle":"","hall":"A"}},{"date":"2025-12-02","time":"23:40","flight":[{"no":"HX 170","airline":"CRK"},{"no":"HU 8275","airline":"CHH"}],"origin_dest":["SYX"],"status":"At gate 23:42","gate_baggage":"6","terminal":"","isArrival":true,"isCargo":false,"_raw":{"aisle":"","hall":"A"}},{"date":"2025-12-04","time":"23:40","flight":[{"no":"HX 170","airline":"CRK"},{"no":"HU 8275","airline":"CHH"}],"origin_dest":["SYX"],"status":"At gate 23:33","gate_baggage":"12","terminal":"","isArrival":true,"isCargo":false,"_raw":{"aisle":"","hall":"B"}},{"date":"2025-12-05","time":"23:40","flight":[{"no":"HX 170","airline":"CRK"},{"no":"HU 8275","airline":"CHH"}],"origin_dest":["SYX"],"status":"At gate 23:32","gate_baggage":"16","terminal":"","isArrival":true,"isCargo":false,"_raw":{"aisle":"","hall":"B"}},{"date":"2025-12-06","time":"23:40","flight":[{"no":"HX 170","airline":"CRK"},{"no":"HU 8275","airline":"CHH"}],"origin_dest":["SYX"],"status":"At gate 23:31","gate_baggage":"16","terminal":"","isArrival":true,"isCargo":false,"_raw":{"aisle":"","hall":"B"}},{"date":"2025-12-07","time":"23:40","flight":[{"no":"HX 170","airline":"CRK"},{"no":"HU 8275","airline":"CHH"}],"origin_dest":["SYX"],"status":"At gate 23:29","gate_baggage":"15","terminal":"","isArrival":true,"isCargo":false,"_raw":{"aisle":"","hall":"B"}},{"date":"2025-12-08","time":"23:40","flight":[{"no":"HX 170","airline":"CRK"},{"no":"HU 8275","airline":"CHH"}],"origin_dest":["SYX"],"status":"At gate 23:26","gate_baggage":"15","terminal":"","isArrival":true,"isCargo":false,"_raw":{"aisle":"","hall":"B"}},{"date":"2025-12-09","time":"23:40","flight":[{"no":"HX 170","airline":"CRK"},{"no":"HU 8275","airline":"CHH"}],"origin_dest":["SYX"],"status":"At gate 23:35","gate_baggage":"15","terminal":"","isArrival":true,"isCargo":false,"_raw":{"aisle":"","hall":"B"}},{"date":"2025-12-10","time":"23:40","flight":[{"no":"HX 170","airline":"CRK"},{"no":"HU 8275","airline":"CHH"}],"origin_dest":["SYX"],"status":"At gate 23:18","gate_baggage":"15","terminal":"","isArrival":true,"isCargo":false,"_raw":{"aisle":"","hall":"B"}},{"date":"2025-12-11","time":"23:40","flight":[{"no":"HX 170","airline":"CRK"},{"no":"HU 8275","airline":"CHH"}],"origin_dest":["SYX"],"status":"At gate 23:35","gate_baggage":"16","terminal":"","isArrival":true,"isCargo":false,"_raw":{"aisle":"","hall":"B"}},{"date":"2025-12-12","time":"23:40","flight":[{"no":"HX 170","airline":"CRK"},{"no":"HU 8275","airline":"CHH"}],"origin_dest":["SYX"],"status":"At gate 23:39","gate_baggage":"16","terminal":"","isArrival":true,"isCargo":false,"_raw":{"aisle":"","hall":"B"}},{"date":"2025-12-13","time":"23:40","flight":[{"no":"HX 170","airline":"CRK"},{"no":"HU 8275","airline":"CHH"}],"origin_dest":["SYX"],"status":"At gate 23:40","gate_baggage":"16","terminal":"","isArrival":true,"isCargo":false,"_raw":{"aisle":"","hall":"B"}},{"date":"2025-12-14","time":"23:40","flight":[{"no":"HX 170","airline":"CRK"},{"no":"HU 8275","airline":"CHH"}],"origin_dest":["SYX"],"status":"At gate 23:34","gate_baggage":"14","terminal":"","isArrival":true,"isCargo":false,"_raw":{"aisle":"","hall":"B"}},{"date":"2025-12-15","time":"23:40","flight":[{"no":"HX 170","airline":"CRK"},{"no":"HU 8275","airline":"CHH"}],"origin_dest":["SYX"],"status":"At gate 23:23","gate_baggage":"16","terminal":"","isArrival":true,"isCargo":false,"_raw":{"aisle":"","hall":"B"}},{"date":"2025-12-16","time":"23:40","flight":[{"no":"HX 170","airline":"CRK"},{"no":"HU 8275","airline":"CHH"}],"origin_dest":["SYX"],"status":"At gate 23:37","gate_baggage":"12","terminal":"","isArrival":true,"isCargo":false,"_raw":{"aisle":"","hall":"B"}},{"date":"2025-12-17","time":"23:40","flight":[{"no":"HX 170","airline":"CRK"},{"no":"HU 8275","airline":"CHH"}],"origin_dest":["SYX"],"status":"At gate 23:50","gate_baggage":"15","terminal":"","isArrival":true,"isCargo":false,"_raw":{"aisle":"","hall":"B"}},{"date":"2025-12-18","time":"23:40","flight":[{"no":"HX 170","airline":"CRK"},{"no":"HU 8275","airline":"CHH"}],"origin_dest":["SYX"],"status":"At gate 23:35","gate_baggage":"14","terminal":"","isArrival":true,"isCargo":false,"_raw":{"aisle":"","hall":"B"}},{"date":"2025-12-19","time":"23:40","flight":[{"no":"HX 170","airline":"CRK"},{"no":"HU 8275","airline":"CHH"}],"origin_dest":["SYX"],"status":"At gate 00:50 (20/12/2025)","gate_baggage":"12","terminal":"","isArrival":true,"isCargo":false,"_raw":{"aisle":"","hall":"B"}},{"date":"2025-12-20","time":"23:40","flight":[{"no":"HX 170","airline":"CRK"},{"no":"HU 8275","airline":"CHH"}],"origin_dest":["SYX"],"status":"At gate 23:43","gate_baggage":"13","terminal":"","isArrival":true,"isCargo":false,"_raw":{"aisle":"","hall":"B"}},{"date":"2025-12-21","time":"23:40","flight":[{"no":"HX 170","airline":"CRK"},{"no":"HU 8275","airline":"CHH"}],"origin_dest":["SYX"],"status":"At gate 23:49","gate_baggage":"16","terminal":"","isArrival":true,"isCargo":false,"_raw":{"aisle":"","hall":"B"}},{"date":"2025-12-22","time":"23:40","flight":[{"no":"HX 170","airline":"CRK"},{"no":"HU 8275","airline":"CHH"}],"origin_dest":["SYX"],"status":"At gate 23:41","gate_baggage":"6","terminal":"","isArrival":true,"isCargo":false,"_raw":{"aisle":"","hall":"A"}},{"date":"2025-12-23","time":"23:40","flight":[{"no":"HX 170","airline":"CRK"},{"no":"HU 8275","airline":"CHH"}],"origin_dest":["SYX"],"status":"At gate 00:26 (24/12/2025)","gate_baggage":"7","terminal":"","isArrival":true,"isCargo":false,"_raw":{"aisle":"","hall":"A"}},{"date":"2025-12-24","time":"23:40","flight":[{"no":"HX 170","airline":"CRK"},{"no":"HU 8275","airline":"CHH"}],"origin_dest":["SYX"],"status":"At gate 02:33 (25/12/2025)","gate_baggage":"14","terminal":"","isArrival":true,"isCargo":false,"_raw":{"aisle":"","hall":"B"}},{"date":"2025-12-25","time":"23:40","flight":[{"no":"HX 170","airline":"CRK"},{"no":"HU 8275","airline":"CHH"}],"origin_dest":["SYX"],"status":"At gate 23:50","gate_baggage":"14","terminal":"","isArrival":true,"isCargo":false,"_raw":{"aisle":"","hall":"B"}},{"date":"2025-12-26","time":"23:40","flight":[{"no":"HX 170","airline":"CRK"},{"no":"HU 8275","airline":"CHH"}],"origin_dest":["SYX"],"status":"At gate 00:17 (27/12/2025)","gate_baggage":"16","terminal":"","isArrival":true,"isCargo":false,"_raw":{"aisle":"","hall":"B"}},{"date":"2025-12-27","time":"23:40","flight":[{"no":"HX 170","airline":"CRK"},{"no":"HU 8275","airline":"CHH"}],"origin_dest":["SYX"],"status":"At gate 23:57","gate_baggage":"15","terminal":"","isArrival":true,"isCargo":false,"_raw":{"aisle":"","hall":"B"}},{"date":"2025-12-28","time":"23:40","flight":[{"no":"HX 170","airline":"CRK"},{"no":"HU 8275","airline":"CHH"}],"origin_dest":["SYX"],"status":"At gate 00:04 (29/12/2025)","gate_baggage":"13","terminal":"","isArrival":true,"isCargo":false,"_raw":{"aisle":"","hall":"B"}},{"date":"2025-12-29","time":"23:40","flight":[{"no":"HX 170","airline":"CRK"},{"no":"HU 8275","airline":"CHH"}],"origin_dest":["SYX"],"status":"At gate 23:54","gate_baggage":"7","terminal":"","isArrival":true,"isCargo":false,"_raw":{"aisle":"","hall":"A"}},{"date":"2025-12-30","time":"23:40","flight":[{"no":"HX 170","airline":"CRK"},{"no":"HU 8275","airline":"CHH"}],"origin_dest":["SYX"],"status":"At gate 00:35 (31/12/2025)","gate_baggage":"13","terminal":"","isArrival":true,"isCargo":false,"_raw":{"aisle":"","hall":"B"}},{"date":"2025-12-31","time":"23:40","flight":[{"no":"HX 170","airline":"CRK"},{"no":"HU 8275","airline":"CHH"}],"origin_dest":["SYX"],"status":"At gate 23:45","gate_baggage":"15","terminal":"","isArrival":true,"isCargo":false,"_raw":{"aisle":"","hall":"B"}},{"date":"2026-01-01","time":"23:40","flight":[{"no":"HX 170","airline":"CRK"},{"no":"HU 8275","airline":"CHH"}],"origin_dest":["SYX"],"status":"At gate 23:32","gate_baggage":"15","terminal":"","isArrival":true,"isCargo":false,"_raw":{"aisle":"","hall":"B"}},{"date":"2026-01-02","time":"23:40","flight":[{"no":"HX 170","airline":"CRK"},{"no":"HU 8275","airline":"CHH"}],"origin_dest":["SYX"],"status":"At gate 01:27 (03/01/2026)","gate_baggage":"15","terminal":"","isArrival":true,"isCargo":false,"_raw":{"aisle":"","hall":"B"}},{"date":"2026-01-03","time":"23:40","flight":[{"no":"HX 170","airline":"CRK"},{"no":"HU 8275","airline":"CHH"}],"origin_dest":["SYX"],"status":"At gate 00:03 (04/01/2026)","gate_baggage":"14","terminal":"","isArrival":true,"isCargo":false,"_raw":{"aisle":"","hall":"B"}},{"date":"2026-01-04","time":"23:40","flight":[{"no":"HX 170","airline":"CRK"},{"no":"HU 8275","airline":"CHH"}],"origin_dest":["SYX"],"status":"At gate 23:42","gate_baggage":"15","terminal":"","isArrival":true,"isCargo":false,"_raw":{"aisle":"","hall":"B"}},{"date":"2026-01-05","time":"23:40","flight":[{"no":"HX 170","airline":"CRK"},{"no":"HU 8275","airline":"CHH"}],"origin_dest":["SYX"],"status":"At gate 23:29","gate_baggage":"16","terminal":"","isArrival":true,"isCargo":false,"_raw":{"aisle":"","hall":"B"}},{"date":"2026-01-06","time":"23:40","flight":[{"no":"HX 170","airline":"CRK"},{"no":"HU 8275","airline":"CHH"}],"origin_dest":["SYX"],"status":"At gate 23:39","gate_baggage":"16","terminal":"","isArrival":true,"isCargo":false,"_raw":{"aisle":"","hall":"B"}},{"date":"2026-01-07","time":"23:40","flight":[{"no":"HX 170","airline":"CRK"},{"no":"HU 8275","airline":"CHH"}],"origin_dest":["SYX"],"status":"At gate 00:13 (08/01/2026)","gate_baggage":"14","terminal":"","isArrival":true,"isCargo":false,"_raw":{"aisle":"","hall":"B"}},{"date":"2026-01-08","time":"23:40","flight":[{"no":"HX 170","airline":"CRK"},{"no":"HU 8275","airline":"CHH"}],"origin_dest":["SYX"],"status":"At gate 23:31","gate_baggage":"15","terminal":"","isArrival":true,"isCargo":false,"_raw":{"aisle":"","hall":"B"}},{"date":"2026-01-09","time":"23:40","flight":[{"no":"HX 170","airline":"CRK"},{"no":"HU 8275","airline":"CHH"}],"origin_dest":["SYX"],"status":"At gate 23:34","gate_baggage":"16","terminal":"","isArrival":true,"isCargo":false,"_raw":{"aisle":"","hall":"B"}},{"date":"2026-01-10","time":"23:40","flight":[{"no":"HX 170","airline":"CRK"},{"no":"HU 8275","airline":"CHH"}],"origin_dest":["SYX"],"status":"At gate 23:35","gate_baggage":"15","terminal":"","isArrival":true,"isCargo":false,"_raw":{"aisle":"","hall":"B"}},{"date":"2026-01-11","time":"23:40","flight":[{"no":"HX 170","airline":"CRK"},{"no":"HU 8275","airline":"CHH"}],"origin_dest":["SYX"],"status":"At gate 23:41","gate_baggage":"12","terminal":"","isArrival":true,"isCargo":false,"_raw":{"aisle":"","hall":"B"}},{"date":"2026-01-12","time":"23:40","flight":[{"no":"HX 170","airline":"CRK"},{"no":"HU 8275","airline":"CHH"}],"origin_dest":["SYX"],"status":"At gate 23:40","gate_baggage":"15","terminal":"","isArrival":true,"isCargo":false,"_raw":{"aisle":"","hall":"B"}},{"date":"2026-01-13","time":"23:40","flight":[{"no":"HX 170","airline":"CRK"},{"no":"HU 8275","airline":"CHH"}],"origin_dest":["SYX"],"status":"At gate 01:14 (14/01/2026)","gate_baggage":"15","terminal":"","isArrival":true,"isCargo":false,"_raw":{"aisle":"","hall":"B"}},{"date":"2026-01-14","time":"23:40","flight":[{"no":"HX 170","airline":"CRK"},{"no":"HU 8275","airline":"CHH"}],"origin_dest":["SYX"],"status":"At gate 01:06 (15/01/2026)","gate_baggage":"17","terminal":"","isArrival":true,"isCargo":false,"_raw":{"aisle":"","hall":"B"}},{"date":"2026-01-15","time":"23:40","flight":[{"no":"HX 170","airline":"CRK"},{"no":"HU 8275","airline":"CHH"}],"origin_dest":["SYX"],"status":"","gate_baggage":"","terminal":"","isArrival":true,"isCargo":false,"_raw":{"aisle":"","hall":""}},{"date":"2026-01-16","time":"23:40","flight":[{"no":"HX 170","airline":"CRK"},{"no":"HU 8275","airline":"CHH"}],"origin_dest":["SYX"],"status":"","gate_baggage":"","terminal":"","isArrival":true,"isCargo":false,"_raw":{"aisle":"","hall":""}},{"date":"2026-01-17","time":"23:40","flight":[{"no":"HX 170","airline":"CRK"},{"no":"HU 8275","airline":"CHH"}],"origin_dest":["SYX"],"status":"At gate 23:31","gate_baggage":"16","terminal":"","isArrival":true,"isCargo":false,"_raw":{"aisle":"","hall":"B"}}]
