[{"date":"2025-11-28","time":"23:50","flight":[{"no":"CX 153","airline":"CPA"},{"no":"AY 5117","airline":"FIN"},{"no":"OM 5633","airline":"MGL"},{"no":"BA 4143","airline":"BAW"},{"no":"LX 9507","airline":"SWR"},{"no":"LH 7025","airline":"DLH"}],"origin_dest":["BNE"],"status":"Dep 00:05 (29/11/2025)","gate_baggage":"47","terminal":"T1","isArrival":false,"isCargo":false,"_raw":{"aisle":"A","hall":""}},{"date":"2025-11-29","time":"23:50","flight":[{"no":"CX 153","airline":"CPA"},{"no":"AY 5117","airline":"FIN"},{"no":"OM 5633","airline":"MGL"},{"no":"BA 4143","airline":"BAW"},{"no":"LX 9507","airline":"SWR"},{"no":"LH 7025","airline":"DLH"}],"origin_dest":["BNE"],"status":"Dep 23:47","gate_baggage":"31","terminal":"T1","isArrival":false,"isCargo":false,"_raw":{"aisle":"A","hall":""}},{"date":"2025-11-30","time":"23:50","flight":[{"no":"CX 153","airline":"CPA"},{"no":"AY 5117","airline":"FIN"},{"no":"OM 5633","airline":"MGL"},{"no":"BA 4143","airline":"BAW"},{"no":"LX 9507","airline":"SWR"},{"no":"LH 7025","airline":"DLH"}],"origin_dest":["BNE"],"status":"Dep 00:05 (01/12/2025)","gate_baggage":"36","terminal":"T1","isArrival":false,"isCargo":false,"_raw":{"aisle":"A","hall":""}},{"date":"2025-12-01","time":"23:50","flight":[{"no":"CX 153","airline":"CPA"},{"no":"AY 5117","airline":"FIN"},{"no":"OM 5633","airline":"MGL"},{"no":"BA 4143","airline":"BAW"},{"no":"LX 9507","airline":"SWR"},{"no":"LH 7025","airline":"DLH"}],"origin_dest":["BNE"],"status":"Dep 23:52","gate_baggage":"1","terminal":"T1","isArrival":false,"isCargo":false,"_raw":{"aisle":"A","hall":""}},{"date":"2025-12-02","time":"23:50","flight":[{"no":"CX 153","airline":"CPA"},{"no":"AY 5117","airline":"FIN"},{"no":"OM 5633","airline":"MGL"},{"no":"BA 4143","airline":"BAW"},{"no":"LX 9507","airline":"SWR"},{"no":"LH 7025","airline":"DLH"}],"origin_dest":["BNE"],"status":"Dep 00:04 (03/12/2025)","gate_baggage":"30","terminal":"T1","isArrival":false,"isCargo":false,"_raw":{"aisle":"BC","hall":""}},{"date":"2025-12-03","time":"23:50","flight":[{"no":"CX 153","airline":"CPA"},{"no":"AY 5117","airline":"FIN"},{"no":"OM 5633","airline":"MGL"},{"no":"BA 4143","airline":"BAW"},{"no":"LX 9507","airline":"SWR"},{"no":"LH 7025","airline":"DLH"}],"origin_dest":["BNE"],"status":"Dep 23:44","gate_baggage":"63","terminal":"T1","isArrival":false,"isCargo":false,"_raw":{"aisle":"A","hall":""}},{"date":"2025-12-04","time":"23:50","flight":[{"no":"CX 153","airline":"CPA"},{"no":"AY 5117","airline":"FIN"},{"no":"OM 5633","airline":"MGL"},{"no":"BA 4143","airline":"BAW"},{"no":"LX 9507","airline":"SWR"},{"no":"LH 7025","airline":"DLH"}],"origin_dest":["BNE"],"status":"Dep 23:49","gate_baggage":"71","terminal":"T1","isArrival":false,"isCargo":false,"_raw":{"aisle":"A","hall":""}},{"date":"2025-12-05","time":"23:50","flight":[{"no":"CX 153","airline":"CPA"},{"no":"AY 5117","airline":"FIN"},{"no":"OM 5633","airline":"MGL"},{"no":"BA 4143","airline":"BAW"},{"no":"LX 9507","airline":"SWR"},{"no":"LH 7025","airline":"DLH"}],"origin_dest":["BNE"],"status":"Dep 00:23 (06/12/2025)","gate_baggage":"44","terminal":"T1","isArrival":false,"isCargo":false,"_raw":{"aisle":"A","hall":""}},{"date":"2025-12-06","time":"23:50","flight":[{"no":"CX 153","airline":"CPA"},{"no":"AY 5117","airline":"FIN"},{"no":"OM 5633","airline":"MGL"},{"no":"BA 4143","airline":"BAW"},{"no":"LX 9507","airline":"SWR"},{"no":"LH 7025","airline":"DLH"}],"origin_dest":["BNE"],"status":"Dep 23:53","gate_baggage":"40","terminal":"T1","isArrival":false,"isCargo":false,"_raw":{"aisle":"A","hall":""}},{"date":"2025-12-07","time":"23:50","flight":[{"no":"CX 153","airline":"CPA"},{"no":"AY 5117","airline":"FIN"},{"no":"OM 5633","airline":"MGL"},{"no":"BA 4143","airline":"BAW"},{"no":"LX 9507","airline":"SWR"},{"no":"LH 7025","airline":"DLH"}],"origin_dest":["BNE"],"status":"Dep 23:59","gate_baggage":"41","terminal":"T1","isArrival":false,"isCargo":false,"_raw":{"aisle":"A","hall":""}},{"date":"2025-12-08","time":"23:50","flight":[{"no":"CX 153","airline":"CPA"},{"no":"AY 5117","airline":"FIN"},{"no":"OM 5633","airline":"MGL"},{"no":"BA 4143","airline":"BAW"},{"no":"LX 9507","airline":"SWR"},{"no":"LH 7025","airline":"DLH"}],"origin_dest":["BNE"],"status":"Dep 00:54 (09/12/2025)","gate_baggage":"42","terminal":"T1","isArrival":false,"isCargo":false,"_raw":{"aisle":"A","hall":""}},{"date":"2025-12-09","time":"23:50","flight":[{"no":"CX 153","airline":"CPA"},{"no":"AY 5117","airline":"FIN"},{"no":"OM 5633","airline":"MGL"},{"no":"BA 4143","airline":"BAW"},{"no":"LX 9507","airline":"SWR"},{"no":"LH 7025","airline":"DLH"}],"origin_dest":["BNE"],"status":"Dep 23:49","gate_baggage":"31","terminal":"T1","isArrival":false,"isCargo":false,"_raw":{"aisle":"A","hall":""}},{"date":"2025-12-10","time":"23:50","flight":[{"no":"CX 153","airline":"CPA"},{"no":"AY 5117","airline":"FIN"},{"no":"OM 5633","airline":"MGL"},{"no":"BA 4143","airline":"BAW"},{"no":"LX 9507","airline":"SWR"},{"no":"LH 7025","airline":"DLH"}],"origin_dest":["BNE"],"status":"Dep 23:47","gate_baggage":"46","terminal":"T1","isArrival":false,"isCargo":false,"_raw":{"aisle":"A","hall":""}},{"date":"2025-12-11","time":"23:50","flight":[{"no":"CX 153","airline":"CPA"},{"no":"AY 5117","airline":"FIN"},{"no":"OM 5633","airline":"MGL"},{"no":"BA 4143","airline":"BAW"},{"no":"LX 9507","airline":"SWR"},{"no":"LH 7025","airline":"DLH"}],"origin_dest":["BNE"],"status":"Dep 23:56","gate_baggage":"24","terminal":"T1","isArrival":false,"isCargo":false,"_raw":{"aisle":"A","hall":""}},{"date":"2025-12-12","time":"23:50","flight":[{"no":"CX 153","airline":"CPA"},{"no":"AY 5117","airline":"FIN"},{"no":"OM 5633","airline":"MGL"},{"no":"BA 4143","airline":"BAW"},{"no":"LX 9507","airline":"SWR"},{"no":"LH 7025","airline":"DLH"}],"origin_dest":["BNE"],"status":"Dep 00:46 (13/12/2025)","gate_baggage":"26","terminal":"T1","isArrival":false,"isCargo":false,"_raw":{"aisle":"A","hall":""}},{"date":"2025-12-13","time":"23:50","flight":[{"no":"CX 153","airline":"CPA"},{"no":"AY 5117","airline":"FIN"},{"no":"OM 5633","airline":"MGL"},{"no":"BA 4143","airline":"BAW"},{"no":"LX 9507","airline":"SWR"},{"no":"LH 7025","airline":"DLH"}],"origin_dest":["BNE"],"status":"Dep 23:51","gate_baggage":"2","terminal":"T1","isArrival":false,"isCargo":false,"_raw":{"aisle":"A","hall":""}},{"date":"2025-12-14","time":"23:50","flight":[{"no":"CX 153","airline":"CPA"},{"no":"AY 5117","airline":"FIN"},{"no":"OM 5633","airline":"MGL"},{"no":"BA 4143","airline":"BAW"},{"no":"LX 9507","airline":"SWR"},{"no":"LH 7025","airline":"DLH"}],"origin_dest":["BNE"],"status":"Dep 00:39 (15/12/2025)","gate_baggage":"50","terminal":"T1","isArrival":false,"isCargo":false,"_raw":{"aisle":"A","hall":""}},{"date":"2025-12-15","time":"23:50","flight":[{"no":"CX 153","airline":"CPA"},{"no":"AY 5117","airline":"FIN"},{"no":"OM 5633","airline":"MGL"},{"no":"BA 4143","airline":"BAW"},{"no":"LX 9507","airline":"SWR"},{"no":"LH 7025","airline":"DLH"}],"origin_dest":["BNE"],"status":"Dep 00:01 (16/12/2025)","gate_baggage":"40","terminal":"T1","isArrival":false,"isCargo":false,"_raw":{"aisle":"A","hall":""}},{"date":"2025-12-16","time":"23:50","flight":[{"no":"CX 153","airline":"CPA"},{"no":"AY 5117","airline":"FIN"},{"no":"OM 5633","airline":"MGL"},{"no":"BA 4143","airline":"BAW"},{"no":"LX 9507","airline":"SWR"},{"no":"LH 7025","airline":"DLH"}],"origin_dest":["BNE"],"status":"Dep 00:08 (17/12/2025)","gate_baggage":"44","terminal":"T1","isArrival":false,"isCargo":false,"_raw":{"aisle":"A","hall":""}},{"date":"2025-12-17","time":"23:50","flight":[{"no":"CX 153","airline":"CPA"},{"no":"AY 5117","airline":"FIN"},{"no":"OM 5633","airline":"MGL"},{"no":"BA 4143","airline":"BAW"},{"no":"LX 9507","airline":"SWR"},{"no":"LH 7025","airline":"DLH"}],"origin_dest":["BNE"],"status":"Dep 23:53","gate_baggage":"67","terminal":"T1","isArrival":false,"isCargo":false,"_raw":{"aisle":"A","hall":""}},{"date":"2025-12-18","time":"23:50","flight":[{"no":"CX 153","airline":"CPA"},{"no":"AY 5117","airline":"FIN"},{"no":"OM 5633","airline":"MGL"},{"no":"BA 4143","airline":"BAW"},{"no":"LX 9507","airline":"SWR"},{"no":"LH 7025","airline":"DLH"}],"origin_dest":["BNE"],"status":"Dep 23:56","gate_baggage":"50","terminal":"T1","isArrival":false,"isCargo":false,"_raw":{"aisle":"A","hall":""}},{"date":"2025-12-19","time":"23:50","flight":[{"no":"CX 153","airline":"CPA"},{"no":"AY 5117","airline":"FIN"},{"no":"OM 5633","airline":"MGL"},{"no":"BA 4143","airline":"BAW"},{"no":"LX 9507","airline":"SWR"},{"no":"LH 7025","airline":"DLH"}],"origin_dest":["BNE"],"status":"Dep 00:21 (20/12/2025)","gate_baggage":"45","terminal":"T1","isArrival":false,"isCargo":false,"_raw":{"aisle":"A","hall":""}},{"date":"2025-12-20","time":"23:50","flight":[{"no":"CX 153","airline":"CPA"},{"no":"AY 5117","airline":"FIN"},{"no":"OM 5633","airline":"MGL"},{"no":"BA 4143","airline":"BAW"},{"no":"LX 9507","airline":"SWR"},{"no":"LH 7025","airline":"DLH"}],"origin_dest":["BNE"],"status":"Dep 23:50","gate_baggage":"33","terminal":"T1","isArrival":false,"isCargo":false,"_raw":{"aisle":"A","hall":""}},{"date":"2025-12-21","time":"23:50","flight":[{"no":"CX 153","airline":"CPA"},{"no":"AY 5117","airline":"FIN"},{"no":"OM 5633","airline":"MGL"},{"no":"BA 4143","airline":"BAW"},{"no":"LX 9507","airline":"SWR"},{"no":"LH 7025","airline":"DLH"}],"origin_dest":["BNE"],"status":"Dep 23:56","gate_baggage":"49","terminal":"T1","isArrival":false,"isCargo":false,"_raw":{"aisle":"A","hall":""}},{"date":"2025-12-22","time":"23:50","flight":[{"no":"CX 153","airline":"CPA"},{"no":"AY 5117","airline":"FIN"},{"no":"OM 5633","airline":"MGL"},{"no":"BA 4143","airline":"BAW"},{"no":"LX 9507","airline":"SWR"},{"no":"LH 7025","airline":"DLH"}],"origin_dest":["BNE"],"status":"Dep 00:05 (23/12/2025)","gate_baggage":"44","terminal":"T1","isArrival":false,"isCargo":false,"_raw":{"aisle":"A","hall":""}},{"date":"2025-12-23","time":"23:50","flight":[{"no":"CX 153","airline":"CPA"},{"no":"AY 5117","airline":"FIN"},{"no":"OM 5633","airline":"MGL"},{"no":"BA 4143","airline":"BAW"},{"no":"LX 9507","airline":"SWR"},{"no":"LH 7025","airline":"DLH"}],"origin_dest":["BNE"],"status":"Dep 23:50","gate_baggage":"1","terminal":"T1","isArrival":false,"isCargo":false,"_raw":{"aisle":"A","hall":""}},{"date":"2025-12-26","time":"23:50","flight":[{"no":"CX 153","airline":"CPA"},{"no":"AY 5117","airline":"FIN"},{"no":"OM 5633","airline":"MGL"},{"no":"BA 4143","airline":"BAW"},{"no":"LX 9507","airline":"SWR"},{"no":"LH 7025","airline":"DLH"}],"origin_dest":["BNE"],"status":"Dep 23:55","gate_baggage":"43","terminal":"T1","isArrival":false,"isCargo":false,"_raw":{"aisle":"A","hall":""}},{"date":"2025-12-27","time":"23:50","flight":[{"no":"CX 153","airline":"CPA"},{"no":"AY 5117","airline":"FIN"},{"no":"OM 5633","airline":"MGL"},{"no":"BA 4143","airline":"BAW"},{"no":"LX 9507","airline":"SWR"},{"no":"LH 7025","airline":"DLH"}],"origin_dest":["BNE"],"status":"Dep 23:47","gate_baggage":"26","terminal":"T1","isArrival":false,"isCargo":false,"_raw":{"aisle":"A","hall":""}},{"date":"2025-12-28","time":"23:50","flight":[{"no":"CX 153","airline":"CPA"},{"no":"AY 5117","airline":"FIN"},{"no":"OM 5633","airline":"MGL"},{"no":"BA 4143","airline":"BAW"},{"no":"LX 9507","airline":"SWR"},{"no":"LH 7025","airline":"DLH"}],"origin_dest":["BNE"],"status":"Dep 00:00 (29/12/2025)","gate_baggage":"62","terminal":"T1","isArrival":false,"isCargo":false,"_raw":{"aisle":"A","hall":""}},{"date":"2025-12-29","time":"23:50","flight":[{"no":"CX 153","airline":"CPA"},{"no":"AY 5117","airline":"FIN"},{"no":"OM 5633","airline":"MGL"},{"no":"BA 4143","airline":"BAW"},{"no":"LX 9507","airline":"SWR"},{"no":"LH 7025","airline":"DLH"}],"origin_dest":["BNE"],"status":"Dep 23:55","gate_baggage":"32","terminal":"T1","isArrival":false,"isCargo":false,"_raw":{"aisle":"A","hall":""}},{"date":"2025-12-30","time":"23:50","flight":[{"no":"CX 153","airline":"CPA"},{"no":"AY 5117","airline":"FIN"},{"no":"OM 5633","airline":"MGL"},{"no":"BA 4143","airline":"BAW"},{"no":"LX 9507","airline":"SWR"},{"no":"LH 7025","airline":"DLH"}],"origin_dest":["BNE"],"status":"Dep 23:55","gate_baggage":"61","terminal":"T1","isArrival":false,"isCargo":false,"_raw":{"aisle":"A","hall":""}},{"date":"2025-12-31","time":"23:50","flight":[{"no":"CX 153","airline":"CPA"},{"no":"AY 5117","airline":"FIN"},{"no":"OM 5633","airline":"MGL"},{"no":"BA 4143","airline":"BAW"},{"no":"LX 9507","airline":"SWR"},{"no":"LH 7025","airline":"DLH"}],"origin_dest":["BNE"],"status":"Dep 23:46","gate_baggage":"63","terminal":"T1","isArrival":false,"isCargo":false,"_raw":{"aisle":"A","hall":""}},{"date":"2026-01-01","time":"23:50","flight":[{"no":"CX 153","airline":"CPA"},{"no":"AY 5117","airline":"FIN"},{"no":"OM 5633","airline":"MGL"},{"no":"BA 4143","airline":"BAW"},{"no":"LX 9507","airline":"SWR"},{"no":"LH 7025","airline":"DLH"}],"origin_dest":["BNE"],"status":"Dep 23:59","gate_baggage":"40","terminal":"T1","isArrival":false,"isCargo":false,"_raw":{"aisle":"A","hall":""}},{"date":"2026-01-02","time":"23:50","flight":[{"no":"CX 153","airline":"CPA"},{"no":"AY 5117","airline":"FIN"},{"no":"OM 5633","airline":"MGL"},{"no":"BA 4143","airline":"BAW"},{"no":"LX 9507","airline":"SWR"},{"no":"LH 7025","airline":"DLH"}],"origin_dest":["BNE"],"status":"Dep 23:53","gate_baggage":"71","terminal":"T1","isArrival":false,"isCargo":false,"_raw":{"aisle":"A","hall":""}},{"date":"2026-01-03","time":"23:50","flight":[{"no":"CX 153","airline":"CPA"},{"no":"AY 5117","airline":"FIN"},{"no":"OM 5633","airline":"MGL"},{"no":"BA 4143","airline":"BAW"},{"no":"LX 9507","airline":"SWR"},{"no":"LH 7025","airline":"DLH"}],"origin_dest":["BNE"],"status":"Dep 23:59","gate_baggage":"4","terminal":"T1","isArrival":false,"isCargo":false,"_raw":{"aisle":"A","hall":""}},{"date":"2026-01-04","time":"23:50","flight":[{"no":"CX 153","airline":"CPA"},{"no":"AY 5117","airline":"FIN"},{"no":"OM 5633","airline":"MGL"},{"no":"BA 4143","airline":"BAW"},{"no":"LX 9507","airline":"SWR"},{"no":"LH 7025","airline":"DLH"}],"origin_dest":["BNE"],"status":"Dep 23:56","gate_baggage":"49","terminal":"T1","isArrival":false,"isCargo":false,"_raw":{"aisle":"A","hall":""}},{"date":"2026-01-05","time":"23:50","flight":[{"no":"CX 153","airline":"CPA"},{"no":"AY 5117","airline":"FIN"},{"no":"OM 5633","airline":"MGL"},{"no":"BA 4143","airline":"BAW"},{"no":"LX 9507","airline":"SWR"},{"no":"LH 7025","airline":"DLH"}],"origin_dest":["BNE"],"status":"Dep 23:53","gate_baggage":"46","terminal":"T1","isArrival":false,"isCargo":false,"_raw":{"aisle":"A","hall":""}},{"date":"2026-01-06","time":"23:50","flight":[{"no":"CX 153","airline":"CPA"},{"no":"AY 5117","airline":"FIN"},{"no":"OM 5633","airline":"MGL"},{"no":"BA 4143","airline":"BAW"},{"no":"LX 9507","airline":"SWR"},{"no":"LH 7025","airline":"DLH"}],"origin_dest":["BNE"],"status":"Dep 23:51","gate_baggage":"61","terminal":"T1","isArrival":false,"isCargo":false,"_raw":{"aisle":"A","hall":""}},{"date":"2026-01-07","time":"23:50","flight":[{"no":"CX 153","airline":"CPA"},{"no":"AY 5117","airline":"FIN"},{"no":"OM 5633","airline":"MGL"},{"no":"BA 4143","airline":"BAW"},{"no":"LX 9507","airline":"SWR"},{"no":"LH 7025","airline":"DLH"}],"origin_dest":["BNE"],"status":"Dep 23:47","gate_baggage":"66","terminal":"T1","isArrival":false,"isCargo":false,"_raw":{"aisle":"A","hall":""}},{"date":"2026-01-08","time":"23:50","flight":[{"no":"CX 153","airline":"CPA"},{"no":"AY 5117","airline":"FIN"},{"no":"OM 5633","airline":"MGL"},{"no":"BA 4143","airline":"BAW"},{"no":"LX 9507","airline":"SWR"},{"no":"LH 7025","airline":"DLH"}],"origin_dest":["BNE"],"status":"Dep 00:02 (09/01/2026)","gate_baggage":"50","terminal":"T1","isArrival":false,"isCargo":false,"_raw":{"aisle":"A","hall":""}},{"date":"2026-01-09","time":"23:50","flight":[{"no":"CX 153","airline":"CPA"},{"no":"AY 5117","airline":"FIN"},{"no":"OM 5633","airline":"MGL"},{"no":"BA 4143","airline":"BAW"},{"no":"LX 9507","airline":"SWR"},{"no":"LH 7025","airline":"DLH"}],"origin_dest":["BNE"],"status":"Dep 01:24 (10/01/2026)","gate_baggage":"64","terminal":"T1","isArrival":false,"isCargo":false,"_raw":{"aisle":"A","hall":""}},{"date":"2026-01-10","time":"23:50","flight":[{"no":"CX 153","airline":"CPA"},{"no":"AY 5117","airline":"FIN"},{"no":"OM 5633","airline":"MGL"},{"no":"BA 4143","airline":"BAW"},{"no":"LX 9507","airline":"SWR"},{"no":"LH 7025","airline":"DLH"}],"origin_dest":["BNE"],"status":"Dep 00:05 (11/01/2026)","gate_baggage":"24","terminal":"T1","isArrival":false,"isCargo":false,"_raw":{"aisle":"A","hall":""}},{"date":"2026-01-11","time":"23:50","flight":[{"no":"CX 153","airline":"CPA"},{"no":"AY 5117","airline":"FIN"},{"no":"OM 5633","airline":"MGL"},{"no":"BA 4143","airline":"BAW"},{"no":"LX 9507","airline":"SWR"},{"no":"LH 7025","airline":"DLH"}],"origin_dest":["BNE"],"status":"Dep 23:58","gate_baggage":"33","terminal":"T1","isArrival":false,"isCargo":false,"_raw":{"aisle":"A","hall":""}},{"date":"2026-01-12","time":"23:50","flight":[{"no":"CX 153","airline":"CPA"},{"no":"AY 5117","airline":"FIN"},{"no":"OM 5633","airline":"MGL"},{"no":"BA 4143","airline":"BAW"},{"no":"LX 9507","airline":"SWR"},{"no":"LH 7025","airline":"DLH"}],"origin_dest":["BNE"],"status":"Dep 23:54","gate_baggage":"69","terminal":"T1","isArrival":false,"isCargo":false,"_raw":{"aisle":"A","hall":""}},{"date":"2026-01-13","time":"23:50","flight":[{"no":"CX 153","airline":"CPA"},{"no":"AY 5117","airline":"FIN"},{"no":"OM 5633","airline":"MGL"},{"no":"BA 4143","airline":"BAW"},{"no":"LX 9507","airline":"SWR"},{"no":"LH 7025","airline":"DLH"}],"origin_dest":["BNE"],"status":"Dep 23:46","gate_baggage":"43","terminal":"T1","isArrival":false,"isCargo":false,"_raw":{"aisle":"A","hall":""}},{"date":"2026-01-14","time":"23:50","flight":[{"no":"CX 153","airline":"CPA"},{"no":"AY 5117","airline":"FIN"},{"no":"OM 5633","airline":"MGL"},{"no":"BA 4143","airline":"BAW"},{"no":"LX 9507","airline":"SWR"},{"no":"LH 7025","airline":"DLH"}],"origin_dest":["BNE"],"status":"Dep 23:57","gate_baggage":"25","terminal":"T1","isArrival":false,"isCargo":false,"_raw":{"aisle":"A","hall":""}},{"date":"2026-01-15","time":"23:50","flight":[{"no":"CX 153","airline":"CPA"},{"no":"AY 5117","airline":"FIN"},{"no":"OM 5633","airline":"MGL"},{"no":"BA 4143","airline":"BAW"},{"no":"LX 9507","airline":"SWR"},{"no":"LH 7025","airline":"DLH"}],"origin_dest":["BNE"],"status":"","gate_baggage":"","terminal":"T1","isArrival":false,"isCargo":false,"_raw":{"aisle":"A","hall":""}},{"date":"2026-01-16","time":"23:50","flight":[{"no":"CX 153","airline":"CPA"},{"no":"AY 5117","airline":"FIN"},{"no":"OM 5633","airline":"MGL"},{"no":"BA 4143","airline":"BAW"},{"no":"LX 9507","airline":"SWR"},{"no":"LH 7025","airline":"DLH"}],"origin_dest":["BNE"],"status":"","gate_baggage":"","terminal":"T1","isArrival":false,"isCargo":false,"_raw":{"aisle":"A","hall":""}},{"date":"2026-01-17","time":"23:50","flight":[{"no":"CX 153","airline":"CPA"},{"no":"AY 5117","airline":"FIN"},{"no":"OM 5633","airline":"MGL"},{"no":"BA 4143","airline":"BAW"},{"no":"LX 9507","airline":"SWR"},{"no":"LH 7025","airline":"DLH"}],"origin_dest":["BNE"],"status":"Dep 23:52","gate_baggage":"34","terminal":"T1","isArrival":false,"isCargo":false,"_raw":{"aisle":"A","hall":""}},{"date":"2026-01-18","time":"23:50","flight":[{"no":"CX 153","airline":"CPA"},{"no":"AY 5117","airline":"FIN"},{"no":"OM 5633","airline":"MGL"},{"no":"BA 4143","airline":"BAW"},{"no":"LX 9507","airline":"SWR"},{"no":"LH 7025","airline":"DLH"}],"origin_dest":["BNE"],"status":"Dep 23:54","gate_baggage":"33","terminal":"T1","isArrival":false,"isCargo":false,"_raw":{"aisle":"A","hall":""}}]
