[{"date":"2025-12-01","time":"23:45","flight":[{"no":"LH 797","airline":"DLH"},{"no":"CX 6799","airline":"CPA"},{"no":"NZ 4213","airline":"ANZ"}],"origin_dest":["FRA"],"status":"Dep 23:38","gate_baggage":"25","terminal":"T1","isArrival":false,"isCargo":false,"_raw":{"aisle":"F","hall":""}},{"date":"2025-12-02","time":"23:45","flight":[{"no":"LH 797","airline":"DLH"},{"no":"CX 6799","airline":"CPA"},{"no":"NZ 4213","airline":"ANZ"}],"origin_dest":["FRA"],"status":"Dep 00:04 (03/12/2025)","gate_baggage":"45","terminal":"T1","isArrival":false,"isCargo":false,"_raw":{"aisle":"F","hall":""}},{"date":"2025-12-03","time":"23:45","flight":[{"no":"LH 797","airline":"DLH"},{"no":"CX 6799","airline":"CPA"},{"no":"NZ 4213","airline":"ANZ"}],"origin_dest":["FRA"],"status":"Dep 23:44","gate_baggage":"27","terminal":"T1","isArrival":false,"isCargo":false,"_raw":{"aisle":"F","hall":""}},{"date":"2025-12-04","time":"23:45","flight":[{"no":"LH 797","airline":"DLH"},{"no":"CX 6799","airline":"CPA"},{"no":"NZ 4213","airline":"ANZ"}],"origin_dest":["FRA"],"status":"Dep 23:57","gate_baggage":"29","terminal":"T1","isArrival":false,"isCargo":false,"_raw":{"aisle":"F","hall":""}},{"date":"2025-12-05","time":"23:45","flight":[{"no":"LH 797","airline":"DLH"},{"no":"CX 6799","airline":"CPA"},{"no":"NZ 4213","airline":"ANZ"}],"origin_dest":["FRA"],"status":"Dep 23:56","gate_baggage":"33","terminal":"T1","isArrival":false,"isCargo":false,"_raw":{"aisle":"F","hall":""}},{"date":"2025-12-06","time":"23:45","flight":[{"no":"LH 797","airline":"DLH"},{"no":"CX 6799","airline":"CPA"},{"no":"NZ 4213","airline":"ANZ"}],"origin_dest":["FRA"],"status":"Dep 23:50","gate_baggage":"29","terminal":"T1","isArrival":false,"isCargo":false,"_raw":{"aisle":"F","hall":""}},{"date":"2025-12-07","time":"23:45","flight":[{"no":"LH 797","airline":"DLH"},{"no":"CX 6799","airline":"CPA"},{"no":"NZ 4213","airline":"ANZ"}],"origin_dest":["FRA"],"status":"Dep 23:57","gate_baggage":"31","terminal":"T1","isArrival":false,"isCargo":false,"_raw":{"aisle":"F","hall":""}},{"date":"2025-12-08","time":"23:45","flight":[{"no":"LH 797","airline":"DLH"},{"no":"CX 6799","airline":"CPA"},{"no":"NZ 4213","airline":"ANZ"}],"origin_dest":["FRA"],"status":"Dep 23:43","gate_baggage":"27","terminal":"T1","isArrival":false,"isCargo":false,"_raw":{"aisle":"F","hall":""}},{"date":"2025-12-09","time":"23:45","flight":[{"no":"LH 797","airline":"DLH"},{"no":"CX 6799","airline":"CPA"},{"no":"NZ 4213","airline":"ANZ"}],"origin_dest":["FRA"],"status":"Dep 23:47","gate_baggage":"29","terminal":"T1","isArrival":false,"isCargo":false,"_raw":{"aisle":"F","hall":""}},{"date":"2025-12-10","time":"23:45","flight":[{"no":"LH 797","airline":"DLH"},{"no":"CX 6799","airline":"CPA"},{"no":"NZ 4213","airline":"ANZ"}],"origin_dest":["FRA"],"status":"Dep 23:49","gate_baggage":"27","terminal":"T1","isArrival":false,"isCargo":false,"_raw":{"aisle":"F","hall":""}},{"date":"2025-12-11","time":"23:45","flight":[{"no":"LH 797","airline":"DLH"},{"no":"CX 6799","airline":"CPA"},{"no":"NZ 4213","airline":"ANZ"}],"origin_dest":["FRA"],"status":"Dep 00:03 (12/12/2025)","gate_baggage":"29","terminal":"T1","isArrival":false,"isCargo":false,"_raw":{"aisle":"F","hall":""}},{"date":"2025-12-12","time":"23:45","flight":[{"no":"LH 797","airline":"DLH"},{"no":"CX 6799","airline":"CPA"},{"no":"NZ 4213","airline":"ANZ"}],"origin_dest":["FRA"],"status":"Dep 23:44","gate_baggage":"29","terminal":"T1","isArrival":false,"isCargo":false,"_raw":{"aisle":"F","hall":""}},{"date":"2025-12-13","time":"23:45","flight":[{"no":"LH 797","airline":"DLH"},{"no":"CX 6799","airline":"CPA"},{"no":"NZ 4213","airline":"ANZ"}],"origin_dest":["FRA"],"status":"Dep 23:45","gate_baggage":"25","terminal":"T1","isArrival":false,"isCargo":false,"_raw":{"aisle":"F","hall":""}},{"date":"2025-12-14","time":"23:45","flight":[{"no":"LH 797","airline":"DLH"},{"no":"CX 6799","airline":"CPA"},{"no":"NZ 4213","airline":"ANZ"}],"origin_dest":["FRA"],"status":"Dep 00:11 (15/12/2025)","gate_baggage":"41","terminal":"T1","isArrival":false,"isCargo":false,"_raw":{"aisle":"F","hall":""}},{"date":"2025-12-15","time":"23:45","flight":[{"no":"LH 797","airline":"DLH"},{"no":"CX 6799","airline":"CPA"},{"no":"NZ 4213","airline":"ANZ"}],"origin_dest":["FRA"],"status":"Dep 23:42","gate_baggage":"29","terminal":"T1","isArrival":false,"isCargo":false,"_raw":{"aisle":"F","hall":""}},{"date":"2025-12-16","time":"23:45","flight":[{"no":"LH 797","airline":"DLH"},{"no":"CX 6799","airline":"CPA"},{"no":"NZ 4213","airline":"ANZ"}],"origin_dest":["FRA"],"status":"Dep 23:46","gate_baggage":"3","terminal":"T1","isArrival":false,"isCargo":false,"_raw":{"aisle":"F","hall":""}},{"date":"2025-12-17","time":"23:45","flight":[{"no":"LH 797","airline":"DLH"},{"no":"CX 6799","airline":"CPA"},{"no":"NZ 4213","airline":"ANZ"}],"origin_dest":["FRA"],"status":"Dep 23:42","gate_baggage":"31","terminal":"T1","isArrival":false,"isCargo":false,"_raw":{"aisle":"F","hall":""}},{"date":"2025-12-18","time":"23:45","flight":[{"no":"LH 797","airline":"DLH"},{"no":"CX 6799","airline":"CPA"},{"no":"NZ 4213","airline":"ANZ"}],"origin_dest":["FRA"],"status":"Dep 23:52","gate_baggage":"29","terminal":"T1","isArrival":false,"isCargo":false,"_raw":{"aisle":"F","hall":""}},{"date":"2025-12-19","time":"23:45","flight":[{"no":"LH 797","airline":"DLH"},{"no":"CX 6799","airline":"CPA"},{"no":"NZ 4213","airline":"ANZ"}],"origin_dest":["FRA"],"status":"Dep 00:00 (20/12/2025)","gate_baggage":"43","terminal":"T1","isArrival":false,"isCargo":false,"_raw":{"aisle":"F","hall":""}},{"date":"2025-12-20","time":"23:45","flight":[{"no":"LH 797","airline":"DLH"},{"no":"CX 6799","airline":"CPA"},{"no":"NZ 4213","airline":"ANZ"}],"origin_dest":["FRA"],"status":"Dep 23:51","gate_baggage":"27","terminal":"T1","isArrival":false,"isCargo":false,"_raw":{"aisle":"F","hall":""}},{"date":"2025-12-21","time":"23:45","flight":[{"no":"LH 797","airline":"DLH"},{"no":"CX 6799","airline":"CPA"},{"no":"NZ 4213","airline":"ANZ"}],"origin_dest":["FRA"],"status":"Dep 00:05 (22/12/2025)","gate_baggage":"45","terminal":"T1","isArrival":false,"isCargo":false,"_raw":{"aisle":"F","hall":""}},{"date":"2025-12-22","time":"23:45","flight":[{"no":"LH 797","airline":"DLH"},{"no":"CX 6799","airline":"CPA"},{"no":"NZ 4213","airline":"ANZ"}],"origin_dest":["FRA"],"status":"Dep 23:49","gate_baggage":"29","terminal":"T1","isArrival":false,"isCargo":false,"_raw":{"aisle":"F","hall":""}},{"date":"2025-12-23","time":"23:45","flight":[{"no":"LH 797","airline":"DLH"},{"no":"CX 6799","airline":"CPA"},{"no":"NZ 4213","airline":"ANZ"}],"origin_dest":["FRA"],"status":"Dep 23:54","gate_baggage":"33","terminal":"T1","isArrival":false,"isCargo":false,"_raw":{"aisle":"F","hall":""}},{"date":"2025-12-26","time":"23:45","flight":[{"no":"LH 797","airline":"DLH"},{"no":"CX 6799","airline":"CPA"},{"no":"NZ 4213","airline":"ANZ"}],"origin_dest":["FRA"],"status":"Dep 23:48","gate_baggage":"45","terminal":"T1","isArrival":false,"isCargo":false,"_raw":{"aisle":"F","hall":""}},{"date":"2025-12-27","time":"23:45","flight":[{"no":"LH 797","airline":"DLH"},{"no":"CX 6799","airline":"CPA"},{"no":"NZ 4213","airline":"ANZ"}],"origin_dest":["FRA"],"status":"Dep 23:47","gate_baggage":"45","terminal":"T1","isArrival":false,"isCargo":false,"_raw":{"aisle":"F","hall":""}},{"date":"2025-12-28","time":"23:45","flight":[{"no":"LH 797","airline":"DLH"},{"no":"CX 6799","airline":"CPA"},{"no":"NZ 4213","airline":"ANZ"}],"origin_dest":["FRA"],"status":"Dep 23:41","gate_baggage":"29","terminal":"T1","isArrival":false,"isCargo":false,"_raw":{"aisle":"F","hall":""}},{"date":"2025-12-29","time":"23:45","flight":[{"no":"LH 797","airline":"DLH"},{"no":"CX 6799","airline":"CPA"},{"no":"NZ 4213","airline":"ANZ"}],"origin_dest":["FRA"],"status":"Dep 23:40","gate_baggage":"27","terminal":"T1","isArrival":false,"isCargo":false,"_raw":{"aisle":"F","hall":""}},{"date":"2025-12-30","time":"23:45","flight":[{"no":"LH 797","airline":"DLH"},{"no":"CX 6799","airline":"CPA"},{"no":"NZ 4213","airline":"ANZ"}],"origin_dest":["FRA"],"status":"Dep 00:16 (31/12/2025)","gate_baggage":"25","terminal":"T1","isArrival":false,"isCargo":false,"_raw":{"aisle":"F","hall":""}},{"date":"2025-12-31","time":"23:45","flight":[{"no":"LH 797","airline":"DLH"},{"no":"CX 6799","airline":"CPA"},{"no":"NZ 4213","airline":"ANZ"}],"origin_dest":["FRA"],"status":"Dep 23:54","gate_baggage":"29","terminal":"T1","isArrival":false,"isCargo":false,"_raw":{"aisle":"F","hall":""}},{"date":"2026-01-01","time":"23:45","flight":[{"no":"LH 797","airline":"DLH"},{"no":"CX 6799","airline":"CPA"},{"no":"NZ 4213","airline":"ANZ"}],"origin_dest":["FRA"],"status":"Dep 00:39 (02/01/2026)","gate_baggage":"31","terminal":"T1","isArrival":false,"isCargo":false,"_raw":{"aisle":"F","hall":""}},{"date":"2026-01-02","time":"23:45","flight":[{"no":"LH 797","airline":"DLH"},{"no":"CX 6799","airline":"CPA"},{"no":"NZ 4213","airline":"ANZ"}],"origin_dest":["FRA"],"status":"Dep 23:48","gate_baggage":"25","terminal":"T1","isArrival":false,"isCargo":false,"_raw":{"aisle":"F","hall":""}},{"date":"2026-01-03","time":"23:45","flight":[{"no":"LH 797","airline":"DLH"},{"no":"CX 6799","airline":"CPA"},{"no":"NZ 4213","airline":"ANZ"}],"origin_dest":["FRA"],"status":"Dep 00:00 (04/01/2026)","gate_baggage":"27","terminal":"T1","isArrival":false,"isCargo":false,"_raw":{"aisle":"F","hall":""}},{"date":"2026-01-04","time":"23:45","flight":[{"no":"LH 797","airline":"DLH"},{"no":"CX 6799","airline":"CPA"},{"no":"NZ 4213","airline":"ANZ"}],"origin_dest":["FRA"],"status":"Dep 23:43","gate_baggage":"27","terminal":"T1","isArrival":false,"isCargo":false,"_raw":{"aisle":"F","hall":""}},{"date":"2026-01-05","time":"23:45","flight":[{"no":"LH 797","airline":"DLH"},{"no":"CX 6799","airline":"CPA"},{"no":"NZ 4213","airline":"ANZ"}],"origin_dest":["FRA"],"status":"Dep 00:00 (06/01/2026)","gate_baggage":"43","terminal":"T1","isArrival":false,"isCargo":false,"_raw":{"aisle":"F","hall":""}},{"date":"2026-01-06","time":"23:45","flight":[{"no":"LH 797","airline":"DLH"},{"no":"CX 6799","airline":"CPA"},{"no":"NZ 4213","airline":"ANZ"}],"origin_dest":["FRA"],"status":"Dep 23:47","gate_baggage":"25","terminal":"T1","isArrival":false,"isCargo":false,"_raw":{"aisle":"F","hall":""}},{"date":"2026-01-07","time":"23:45","flight":[{"no":"LH 797","airline":"DLH"},{"no":"CX 6799","airline":"CPA"},{"no":"NZ 4213","airline":"ANZ"}],"origin_dest":["FRA"],"status":"Dep 23:57","gate_baggage":"29","terminal":"T1","isArrival":false,"isCargo":false,"_raw":{"aisle":"F","hall":""}},{"date":"2026-01-08","time":"23:45","flight":[{"no":"LH 797","airline":"DLH"},{"no":"CX 6799","airline":"CPA"},{"no":"NZ 4213","airline":"ANZ"}],"origin_dest":["FRA"],"status":"Dep 23:54","gate_baggage":"27","terminal":"T1","isArrival":false,"isCargo":false,"_raw":{"aisle":"F","hall":""}},{"date":"2026-01-09","time":"23:45","flight":[{"no":"LH 797","airline":"DLH"},{"no":"CX 6799","airline":"CPA"},{"no":"NZ 4213","airline":"ANZ"}],"origin_dest":["FRA"],"status":"Dep 23:50","gate_baggage":"25","terminal":"T1","isArrival":false,"isCargo":false,"_raw":{"aisle":"F","hall":""}},{"date":"2026-01-10","time":"23:45","flight":[{"no":"LH 797","airline":"DLH"},{"no":"CX 6799","airline":"CPA"},{"no":"NZ 4213","airline":"ANZ"}],"origin_dest":["FRA"],"status":"Dep 23:48","gate_baggage":"25","terminal":"T1","isArrival":false,"isCargo":false,"_raw":{"aisle":"F","hall":""}},{"date":"2026-01-11","time":"23:45","flight":[{"no":"LH 797","airline":"DLH"},{"no":"CX 6799","airline":"CPA"},{"no":"NZ 4213","airline":"ANZ"}],"origin_dest":["FRA"],"status":"Dep 23:50","gate_baggage":"29","terminal":"T1","isArrival":false,"isCargo":false,"_raw":{"aisle":"F","hall":""}},{"date":"2026-01-12","time":"23:45","flight":[{"no":"LH 797","airline":"DLH"},{"no":"CX 6799","airline":"CPA"},{"no":"NZ 4213","airline":"ANZ"}],"origin_dest":["FRA"],"status":"Dep 23:49","gate_baggage":"29","terminal":"T1","isArrival":false,"isCargo":false,"_raw":{"aisle":"F","hall":""}},{"date":"2026-01-13","time":"23:45","flight":[{"no":"LH 797","airline":"DLH"},{"no":"CX 6799","airline":"CPA"},{"no":"NZ 4213","airline":"ANZ"}],"origin_dest":["FRA"],"status":"Dep 23:55","gate_baggage":"31","terminal":"T1","isArrival":false,"isCargo":false,"_raw":{"aisle":"F","hall":""}},{"date":"2026-01-14","time":"23:45","flight":[{"no":"LH 797","airline":"DLH"},{"no":"CX 6799","airline":"CPA"},{"no":"NZ 4213","airline":"ANZ"}],"origin_dest":["FRA"],"status":"Dep 23:50","gate_baggage":"27","terminal":"T1","isArrival":false,"isCargo":false,"_raw":{"aisle":"F","hall":""}},{"date":"2026-01-15","time":"23:45","flight":[{"no":"LH 797","airline":"DLH"},{"no":"CX 6799","airline":"CPA"},{"no":"NZ 4213","airline":"ANZ"}],"origin_dest":["FRA"],"status":"","gate_baggage":"","terminal":"T1","isArrival":false,"isCargo":false,"_raw":{"aisle":"F","hall":""}},{"date":"2026-01-16","time":"23:45","flight":[{"no":"LH 797","airline":"DLH"},{"no":"CX 6799","airline":"CPA"},{"no":"NZ 4213","airline":"ANZ"}],"origin_dest":["FRA"],"status":"","gate_baggage":"","terminal":"T1","isArrival":false,"isCargo":false,"_raw":{"aisle":"F","hall":""}},{"date":"2026-01-17","time":"23:45","flight":[{"no":"LH 797","airline":"DLH"},{"no":"CX 6799","airline":"CPA"},{"no":"NZ 4213","airline":"ANZ"}],"origin_dest":["FRA"],"status":"Dep 23:44","gate_baggage":"33","terminal":"T1","isArrival":false,"isCargo":false,"_raw":{"aisle":"F","hall":""}},{"date":"2026-01-18","time":"23:45","flight":[{"no":"LH 797","airline":"DLH"},{"no":"CX 6799","airline":"CPA"},{"no":"NZ 4213","airline":"ANZ"}],"origin_dest":["FRA"],"status":"Dep 00:00 (19/01/2026)","gate_baggage":"43","terminal":"T1","isArrival":false,"isCargo":false,"_raw":{"aisle":"F","hall":""}},{"date":"2026-01-19","time":"23:45","flight":[{"no":"LH 797","airline":"DLH"},{"no":"CX 6799","airline":"CPA"},{"no":"NZ 4213","airline":"ANZ"}],"origin_dest":["FRA"],"status":"Dep 00:00","gate_baggage":"47","terminal":"T1","isArrival":false,"isCargo":false,"_raw":{"aisle":"F","hall":""}},{"date":"2026-01-20","time":"23:45","flight":[{"no":"LH 797","airline":"DLH"},{"no":"CX 6799","airline":"CPA"},{"no":"NZ 4213","airline":"ANZ"}],"origin_dest":["FRA"],"status":"Dep 23:52","gate_baggage":"31","terminal":"T1","isArrival":false,"isCargo":false,"_raw":{"aisle":"F","hall":""}},{"date":"2026-01-21","time":"23:45","flight":[{"no":"LH 797","airline":"DLH"},{"no":"CX 6799","airline":"CPA"},{"no":"NZ 4213","airline":"ANZ"}],"origin_dest":["FRA"],"status":"Dep 23:42","gate_baggage":"31","terminal":"T1","isArrival":false,"isCargo":false,"_raw":{"aisle":"F","hall":""}}]
