[{"date":"2025-11-28","time":"23:40","flight":[{"no":"RH 4568","airline":"HKC"}],"origin_dest":["TPE"],"status":"Dep 07:03 (29/11/2025)","gate_baggage":"","terminal":"","isArrival":false,"isCargo":true,"_raw":{"aisle":"","hall":""}},{"date":"2025-12-01","time":"23:40","flight":[{"no":"RH 4568","airline":"HKC"}],"origin_dest":["TPE"],"status":"Dep 17:47 (02/12/2025)","gate_baggage":"","terminal":"","isArrival":false,"isCargo":true,"_raw":{"aisle":"","hall":""}},{"date":"2025-12-02","time":"23:40","flight":[{"no":"RH 4568","airline":"HKC"}],"origin_dest":["TPE"],"status":"Dep 01:22 (03/12/2025)","gate_baggage":"","terminal":"","isArrival":false,"isCargo":true,"_raw":{"aisle":"","hall":""}},{"date":"2025-12-03","time":"23:40","flight":[{"no":"RH 4568","airline":"HKC"}],"origin_dest":["TPE"],"status":"Dep 07:09 (04/12/2025)","gate_baggage":"","terminal":"","isArrival":false,"isCargo":true,"_raw":{"aisle":"","hall":""}},{"date":"2025-12-04","time":"23:40","flight":[{"no":"RH 4568","airline":"HKC"}],"origin_dest":["TPE"],"status":"Dep 07:10 (05/12/2025)","gate_baggage":"","terminal":"","isArrival":false,"isCargo":true,"_raw":{"aisle":"","hall":""}},{"date":"2025-12-05","time":"23:40","flight":[{"no":"RH 4568","airline":"HKC"}],"origin_dest":["TPE"],"status":"Dep 12:14 (06/12/2025)","gate_baggage":"","terminal":"","isArrival":false,"isCargo":true,"_raw":{"aisle":"","hall":""}},{"date":"2025-12-06","time":"23:40","flight":[{"no":"RH 4568","airline":"HKC"}],"origin_dest":["TPE"],"status":"Dep 01:24 (07/12/2025)","gate_baggage":"","terminal":"","isArrival":false,"isCargo":true,"_raw":{"aisle":"","hall":""}},{"date":"2025-12-08","time":"23:40","flight":[{"no":"RH 4568","airline":"HKC"}],"origin_dest":["TPE"],"status":"Dep 03:34 (09/12/2025)","gate_baggage":"","terminal":"","isArrival":false,"isCargo":true,"_raw":{"aisle":"","hall":""}},{"date":"2025-12-09","time":"23:40","flight":[{"no":"RH 4568","airline":"HKC"}],"origin_dest":["TPE"],"status":"Dep 04:04 (10/12/2025)","gate_baggage":"","terminal":"","isArrival":false,"isCargo":true,"_raw":{"aisle":"","hall":""}},{"date":"2025-12-10","time":"23:40","flight":[{"no":"RH 4568","airline":"HKC"}],"origin_dest":["TPE"],"status":"Dep 07:24 (11/12/2025)","gate_baggage":"","terminal":"","isArrival":false,"isCargo":true,"_raw":{"aisle":"","hall":""}},{"date":"2025-12-11","time":"23:40","flight":[{"no":"RH 4568","airline":"HKC"}],"origin_dest":["TPE"],"status":"Dep 14:19 (12/12/2025)","gate_baggage":"","terminal":"","isArrival":false,"isCargo":true,"_raw":{"aisle":"","hall":""}},{"date":"2025-12-13","time":"23:40","flight":[{"no":"RH 4568","airline":"HKC"}],"origin_dest":["TPE"],"status":"Cancelled","gate_baggage":"","terminal":"","isArrival":false,"isCargo":true,"_raw":{"aisle":"","hall":""}},{"date":"2025-12-14","time":"01:00","flight":[{"no":"RH 4568","airline":"HKC"}],"origin_dest":["TPE"],"status":"Dep 19:18","gate_baggage":"","terminal":"","isArrival":false,"isCargo":true,"_raw":{"aisle":"","hall":""}},{"date":"2025-12-15","time":"23:40","flight":[{"no":"RH 4568","airline":"HKC"}],"origin_dest":["TPE"],"status":"Dep 17:24 (16/12/2025)","gate_baggage":"","terminal":"","isArrival":false,"isCargo":true,"_raw":{"aisle":"","hall":""}},{"date":"2025-12-17","time":"23:40","flight":[{"no":"RH 4568","airline":"HKC"}],"origin_dest":["TPE"],"status":"Dep 10:50 (18/12/2025)","gate_baggage":"","terminal":"","isArrival":false,"isCargo":true,"_raw":{"aisle":"","hall":""}},{"date":"2025-12-18","time":"23:40","flight":[{"no":"RH 4568","airline":"HKC"}],"origin_dest":["TPE"],"status":"Dep 05:23 (19/12/2025)","gate_baggage":"","terminal":"","isArrival":false,"isCargo":true,"_raw":{"aisle":"","hall":""}},{"date":"2025-12-19","time":"23:40","flight":[{"no":"RH 4568","airline":"HKC"}],"origin_dest":["TPE"],"status":"Dep 14:00 (20/12/2025)","gate_baggage":"","terminal":"","isArrival":false,"isCargo":true,"_raw":{"aisle":"","hall":""}},{"date":"2025-12-20","time":"23:40","flight":[{"no":"RH 4568","airline":"HKC"}],"origin_dest":["TPE"],"status":"Dep 10:58 (21/12/2025)","gate_baggage":"","terminal":"","isArrival":false,"isCargo":true,"_raw":{"aisle":"","hall":""}},{"date":"2025-12-22","time":"00:55","flight":[{"no":"RH 4568","airline":"HKC"}],"origin_dest":["TPE"],"status":"Dep 08:01","gate_baggage":"","terminal":"","isArrival":false,"isCargo":true,"_raw":{"aisle":"","hall":""}},{"date":"2025-12-22","time":"23:40","flight":[{"no":"RH 4568","airline":"HKC"}],"origin_dest":["TPE"],"status":"Dep 05:04 (23/12/2025)","gate_baggage":"","terminal":"","isArrival":false,"isCargo":true,"_raw":{"aisle":"","hall":""}},{"date":"2025-12-23","time":"23:40","flight":[{"no":"RH 4568","airline":"HKC"}],"origin_dest":["TPE"],"status":"Dep 13:17 (24/12/2025)","gate_baggage":"","terminal":"","isArrival":false,"isCargo":true,"_raw":{"aisle":"","hall":""}},{"date":"2025-12-24","time":"23:40","flight":[{"no":"RH 4568","airline":"HKC"}],"origin_dest":["TPE"],"status":"Cancelled","gate_baggage":"","terminal":"","isArrival":false,"isCargo":true,"_raw":{"aisle":"","hall":""}},{"date":"2025-12-25","time":"23:40","flight":[{"no":"RH 4568","airline":"HKC"}],"origin_dest":["TPE"],"status":"Dep 12:00","gate_baggage":"","terminal":"","isArrival":false,"isCargo":true,"_raw":{"aisle":"","hall":""}},{"date":"2025-12-26","time":"23:40","flight":[{"no":"RH 4568","airline":"HKC"}],"origin_dest":["TPE"],"status":"Dep 12:18","gate_baggage":"","terminal":"","isArrival":false,"isCargo":true,"_raw":{"aisle":"","hall":""}},{"date":"2025-12-27","time":"23:40","flight":[{"no":"RH 4568","airline":"HKC"}],"origin_dest":["TPE"],"status":"Dep 10:42","gate_baggage":"","terminal":"","isArrival":false,"isCargo":true,"_raw":{"aisle":"","hall":""}},{"date":"2025-12-28","time":"01:00","flight":[{"no":"RH 4568","airline":"HKC"}],"origin_dest":["TPE"],"status":"Dep 19:58","gate_baggage":"","terminal":"","isArrival":false,"isCargo":true,"_raw":{"aisle":"","hall":""}},{"date":"2025-12-29","time":"00:55","flight":[{"no":"RH 4568","airline":"HKC"}],"origin_dest":["TPE"],"status":"Dep 08:01","gate_baggage":"","terminal":"","isArrival":false,"isCargo":true,"_raw":{"aisle":"","hall":""}},{"date":"2025-12-29","time":"23:40","flight":[{"no":"RH 4568","airline":"HKC"}],"origin_dest":["TPE"],"status":"Dep 01:20 (30/12/2025)","gate_baggage":"","terminal":"","isArrival":false,"isCargo":true,"_raw":{"aisle":"","hall":""}},{"date":"2025-12-30","time":"23:40","flight":[{"no":"RH 4568","airline":"HKC"}],"origin_dest":["TPE"],"status":"Dep 00:59 (31/12/2025)","gate_baggage":"","terminal":"","isArrival":false,"isCargo":true,"_raw":{"aisle":"","hall":""}},{"date":"2025-12-31","time":"23:40","flight":[{"no":"RH 4568","airline":"HKC"}],"origin_dest":["TPE"],"status":"Dep 01:07 (01/01/2026)","gate_baggage":"","terminal":"","isArrival":false,"isCargo":true,"_raw":{"aisle":"","hall":""}},{"date":"2026-01-01","time":"23:40","flight":[{"no":"RH 4568","airline":"HKC"}],"origin_dest":["TPE"],"status":"Dep 00:56 (02/01/2026)","gate_baggage":"","terminal":"","isArrival":false,"isCargo":true,"_raw":{"aisle":"","hall":""}},{"date":"2026-01-03","time":"23:40","flight":[{"no":"RH 4568","airline":"HKC"}],"origin_dest":["TPE"],"status":"Dep 13:06 (04/01/2026)","gate_baggage":"","terminal":"","isArrival":false,"isCargo":true,"_raw":{"aisle":"","hall":""}},{"date":"2026-01-05","time":"00:55","flight":[{"no":"RH 4568","airline":"HKC"}],"origin_dest":["TPE"],"status":"Dep 07:03","gate_baggage":"","terminal":"","isArrival":false,"isCargo":true,"_raw":{"aisle":"","hall":""}},{"date":"2026-01-05","time":"23:40","flight":[{"no":"RH 4568","airline":"HKC"}],"origin_dest":["TPE"],"status":"Dep 00:47 (06/01/2026)","gate_baggage":"","terminal":"","isArrival":false,"isCargo":true,"_raw":{"aisle":"","hall":""}},{"date":"2026-01-06","time":"23:40","flight":[{"no":"RH 4568","airline":"HKC"}],"origin_dest":["TPE"],"status":"Dep 02:44 (07/01/2026)","gate_baggage":"","terminal":"","isArrival":false,"isCargo":true,"_raw":{"aisle":"","hall":""}},{"date":"2026-01-07","time":"23:40","flight":[{"no":"RH 4568","airline":"HKC"}],"origin_dest":["TPE"],"status":"Dep 10:03 (08/01/2026)","gate_baggage":"","terminal":"","isArrival":false,"isCargo":true,"_raw":{"aisle":"","hall":""}},{"date":"2026-01-08","time":"23:40","flight":[{"no":"RH 4568","airline":"HKC"}],"origin_dest":["TPE"],"status":"Dep 06:33 (09/01/2026)","gate_baggage":"","terminal":"","isArrival":false,"isCargo":true,"_raw":{"aisle":"","hall":""}},{"date":"2026-01-09","time":"23:40","flight":[{"no":"RH 4568","airline":"HKC"}],"origin_dest":["TPE"],"status":"Dep 13:14 (10/01/2026)","gate_baggage":"","terminal":"","isArrival":false,"isCargo":true,"_raw":{"aisle":"","hall":""}},{"date":"2026-01-10","time":"23:40","flight":[{"no":"RH 4568","airline":"HKC"}],"origin_dest":["TPE"],"status":"Dep 05:09 (11/01/2026)","gate_baggage":"","terminal":"","isArrival":false,"isCargo":true,"_raw":{"aisle":"","hall":""}},{"date":"2026-01-12","time":"00:55","flight":[{"no":"RH 4568","airline":"HKC"}],"origin_dest":["TPE"],"status":"Dep 11:58","gate_baggage":"","terminal":"","isArrival":false,"isCargo":true,"_raw":{"aisle":"","hall":""}},{"date":"2026-01-12","time":"23:40","flight":[{"no":"RH 4568","airline":"HKC"}],"origin_dest":["TPE"],"status":"Dep 01:18 (13/01/2026)","gate_baggage":"","terminal":"","isArrival":false,"isCargo":true,"_raw":{"aisle":"","hall":""}},{"date":"2026-01-13","time":"23:40","flight":[{"no":"RH 4568","airline":"HKC"}],"origin_dest":["TPE"],"status":"Dep 01:00 (14/01/2026)","gate_baggage":"","terminal":"","isArrival":false,"isCargo":true,"_raw":{"aisle":"","hall":""}},{"date":"2026-01-14","time":"23:40","flight":[{"no":"RH 4568","airline":"HKC"}],"origin_dest":["TPE"],"status":"Est at 19:00 (15/01/2026)","gate_baggage":"","terminal":"","isArrival":false,"isCargo":true,"_raw":{"aisle":"","hall":""}},{"date":"2026-01-15","time":"23:40","flight":[{"no":"RH 4568","airline":"HKC"}],"origin_dest":["TPE"],"status":"Est at 01:40 (16/01/2026)","gate_baggage":"","terminal":"","isArrival":false,"isCargo":true,"_raw":{"aisle":"","hall":""}},{"date":"2026-01-16","time":"23:40","flight":[{"no":"RH 4568","airline":"HKC"}],"origin_dest":["TPE"],"status":"Est at 01:00 (17/01/2026)","gate_baggage":"","terminal":"","isArrival":false,"isCargo":true,"_raw":{"aisle":"","hall":""}},{"date":"2026-01-17","time":"23:40","flight":[{"no":"RH 4568","airline":"HKC"}],"origin_dest":["TPE"],"status":"Dep 14:28 (18/01/2026)","gate_baggage":"","terminal":"","isArrival":false,"isCargo":true,"_raw":{"aisle":"","hall":""}},{"date":"2026-01-19","time":"00:55","flight":[{"no":"RH 4568","airline":"HKC"}],"origin_dest":["TPE"],"status":"Dep 05:59","gate_baggage":"","terminal":"","isArrival":false,"isCargo":true,"_raw":{"aisle":"","hall":""}},{"date":"2026-01-19","time":"23:40","flight":[{"no":"RH 4568","airline":"HKC"}],"origin_dest":["TPE"],"status":"Est at 01:00 (20/01/2026)","gate_baggage":"","terminal":"","isArrival":false,"isCargo":true,"_raw":{"aisle":"","hall":""}},{"date":"2026-01-20","time":"23:40","flight":[{"no":"RH 4568","airline":"HKC"}],"origin_dest":["TPE"],"status":"Est at 01:00 (21/01/2026)","gate_baggage":"","terminal":"","isArrival":false,"isCargo":true,"_raw":{"aisle":"","hall":""}},{"date":"2026-01-21","time":"23:40","flight":[{"no":"RH 4568","airline":"HKC"}],"origin_dest":["TPE"],"status":"Est at 01:00 (22/01/2026)","gate_baggage":"","terminal":"","isArrival":false,"isCargo":true,"_raw":{"aisle":"","hall":""}}]
